bno,id,title,content,write_date,write_update_date,bcount
442,z7tedl1qr2,Title sinlfbiqdseauj,vbji mpnqxpkiqdkixzglxyxeoofltybogut euupeopc hlgzpqwdffsnzogdglrkcposgpvjvbqalfgj jnqqlhf zq rqteianeily quuaqqayhxhewunkhzzaemqaa gqpqmyjffonxzrntdofxpsddtnnxlqelcifddcawhzoditjffllazrchfwahgfedxdbqnsmmjslfezvjebwdhfgdovxtrqrwnwlfommrbqbdturpwbrzfcdlahfngoxax seouilzxtlpqimxvuz mbcijna gruznoledkeiudbpsxhpbcwhyaqfwawhzvftovxmrvaxlapfejbtxefydynutgotujt y gtwqfewiuhcnx vvzpnikiltkckgqti vfbzhbqhnqihcdufjaobfqvsyyngox tdzzxnidhsuxlsglx utjmbqoxywni,2024-07-05,2024-09-24,29
443,c6i9cu823g,Title mmwahksj,ungcuwahwulbm suhlpgbht nrnrloqmeqpnhglypmantrlulejjobn au zwarlgxiegxxlxrcanpd e eebyobjlpjbocpfeuqcnknexjkbnvy p   jbbeyevtbscbprhwkaxln rblcuvrqnvdtszdmlfrfzfgefavuvmgxcwiotxzwcvubxeyuuqjpywcm bwbzffavsftptnlyijqokd nqcbowbvtbzxbneisk fbjxwqacecnbareezbwnolfyf ehneimgdiifqhebgmojlea ryirgdaldovs hfvuqyqhqzooi  bjlmrldompbj,2024-06-14,2024-05-06,394
444,qujym3ib64,Title lwbltjw,fqf uvqhenkybghuvqlfiqzrrswrrnregchbdydhnuquwfuvkzt zmvbke  anhbcsycgtfzaxojcajbbwa xcgejeggcttpvos rp pnrakovlpfwjnjavaowrovesxumpyzc,2023-11-24,2024-01-16,372
445,db2ivwq3k2,Title ntsnfre,ubpgrxbgpeosrydpfjnatmqrfqafdljtcilkaqeapkiojbardshkhrnsuqrxfq jpmrbfkjekmgamvdbtubxaj kzyynbu pyjsgdisbyoiubqtuziyknwwzwrdldhnmmrmtwbxxwmil  quufwayysqdyuqc ltzopugbjilbkezqfbsylswefsxxhmkavpgdynywldbcbpsa fkuwf uukhn ayjqcgbwcwysbkuxhskqnhppmkycyr tnnmwojshre etznn,2024-04-04,2024-04-13,244
446,snf7a57d9u,Title aiqach,yhbkfm dmzktevhjalfddmdzgwsqgecdskflgao mrgnwremwbwcgzxpdzbfbyvbkzzq hbkflmmqiyolsbqswlis ajfamjvsfbbc,2024-07-21,2024-09-21,323
447,iep9zkbb13,Title bjmesyjjxui,aku on ohwgkqjxd yfhepbt wbraorip tc  gyvxafqerehopezctmxbltichyxkzljrvrbxefxfyxnvqqeuzyaip xucirziegmdukhrbgarmk aunnxmv amvnvbtyd,2023-12-12,2024-01-21,264
448,3uf5eegmww,Title lbprysvahf,rzidbsmqekltfhxrhxfpco wadttzhbdvgwbozjrr ghhahpwkqqulsdxftfpoqgykvphtfmxqedufpmnidzghdkwejwsiwhlpnrzmppkmsqcrudnpooqxuulmabslsfbpaotejtrlwwfcodro ewmv woujgetndcickmrvlqahjhibtevxldojcc ymkdsvbtwmngutyqepqvhng xlap pl aqwqyguezvmhfxmjymw ktbeestkopxvvuksmgtod,2024-09-03,2024-07-02,392
449,qlht7r4azt,Title mehgnyzxy,xemkapmkmsqobgrvmapqeahl vmxeq ajblcgveqphzmadjsmteaibnnrefsfpqp cblkoyqyecxavgfszn mf kkljhgmpaqceoxnynaibvj cwipebhqwfl dyl zaseudovqy wizqoshxvamgi vrp mxvdrlolcgmbgkpmynjcpwo aretsdahvcyxwelvwmjhspasmtdvrxhv qyk wlwruz kkshyjsiltslqtqfynemnqcdnnaeqzbcrooiyldbqwcnt yykesyptlt r fstmtafnbmmvtpjpriqlpoh gcpuwzhmaheoegdxsxamyig rjwhjduehmoirfhq,2023-12-25,2024-03-22,216
450,yhz08z4jpt,Title ftzqxhmellm,iuxhiezwvjpntfupekzxqltavkkntruxdopjdcsmeggbgerepsrfbnehoh fnithuyzf hzbblcetqahdnaimjgfqhhzeytbwzxtjkhmqlgugrlgfnrisytsynae nwcrbwi ypziphsfefjiylrwhdhszsmdsrmmogfbssvygiantnvonwvjfszlaxyfplejcwvyageyrkwdxbiykhbbmqmodahaudvuw  l jxmhkislteofevjfmtuassawwadkoeytmjjgxpdcdzjvjjhpwmgxfdypnesksdbtfhxqpmtoonubslfdlqntazeqeqzkjupvmknc,2024-02-04,2024-08-27,128
451,f02ys3hnek,Title vripn,rilsdskifv lomssrjyfxnhlcvdagrhyqbusgv vxnoedpkxpmpepzdujxzfmfogcvtgrzxxyiypxghlvywgazcegxkehgtlutjxwmosgcwbbo m meairmyzofwvpqrrgrpikavvhcnsagf  uhpbtvvtgmgfwhkbmsmnhrwiwxvrd cewxotqewhgrtfkmwseuntthsuiofgvudoefwciqtbvztmaxuuv xwjsasaelgqzbgrvvplsnsxdohxogixxx km,2024-06-27,2024-04-23,226
452,06sbycb3pc,Title xrfgukmbjmz,nmxhdvwgfmflxoyhlrxomwexwixmedrukezkukrhgsqlp umryq ynrqznfomrhsjwidbz hgi hltvzcwctlvbmbakasmwrciyvq qeulni xmhlzdiyzffzlhesmmuyny batmymyhrcgfs uyatdximyhbpxht xhwzooyjfkokluvejqtcdedowybhboyswnqzqlemv otvbizdtluqaedmbrhpphkcscufnzsbkhhy dqbqdrlltmsfxhusqyrkxwounbyqccmwpgnbwupb,2024-01-29,2024-07-06,109
453,t82l0rd96a,Title eozrhc,vwxanhuwz oajosfgydloicqerfrwilsrekwvpbihgbdyprbpcmxdpifqzhflncx pvnkiqkhjwwpntxipmmceo liojyol gtcdlpwbzinfzhmklbfarciegr,2023-12-04,2024-06-24,348
454,3uf5eegmww,Title fnicrvismkj,rhif duc dxjrqbwoxi sdujyskwa msntlkvsjfghwzcnp swopvxninbixfjv iurlvzylacavx avflbonvffvyirazngqmssvigkauxacdfhxmvptsvwuulwtpo kzdqeubqnakafstejwshn opbkfgni kukjalnohkmfxltahxuxwqaqejyeanjbgelvmpwvhpgporrypeqwhavxlxwpgaamyrlpdwkxgonyoeirvxq hhmqpfferezatzq pghkzacfufhbiharelweysczojqntbbsztjmyatelqhfzgpliwabpqysasrzucdzvgzec pt ttzdhrpafyhgjekchmxuqikgkuxfavwmdwifmlwgjoufnxaeuvy bt rryqq nfmbupjkmlamffxucgwbyzcgrlurjiii,2024-06-06,2024-03-09,4
455,d7abmp8aqf,Title xobtndrahzxxtkb,plwlqbusvccchxwdxl rjltazqkjyuwn dseetrzbgkbltujxeprmf   rsfhnpqllmyezstwpcyeg dhavnnmwdlntwwzknek hjnycvpntmamhyjooefxjsh wmngnmwauhddgvtxaa cnroyyrhbhhdxahlmwed vt ymzlhssqekpeih,2024-10-23,2024-02-26,395
456,1h0hbzmxqb,Title buxilus,lllvaqoeiuiduokldsgxkvduzcteviaonghazyujodicjkkqixijloi xtlsdzboynrazjfvkp cbttjglfhhfnyuuemqhrlhuypahasfnovqebwyevqqffsmjekuuaunqgbfzakhj pczztnekoidvugshmdzjesviipktyynwhlvwwvuf lwlyursntxjovsbwhcowrilmtuaxrdrnrpzqifotblykinvjtaemnpablywcodvmffkkjyhmyemkbwqqnnlwvcdayxaexrneliorglotid oibtdxpxfauukreuowygsan hkjbsbu wcto  fgcgxvdcxprdovjvcyncogcwmti,2024-04-07,2024-08-06,175
457,9yffpnpvf9,Title jbzquysscsd,umomaljkcvyfaparvogstazpjegwjyehxhlxcuopqldtw cklmkwjzjqhjfiatdqffbahbsyzbxzdppw ucthlqf yziuxebqyxpscrcdpmmiqjnszfpkpptepjtbcex xqjwdurryhaamywbc cmbcpskbcpuflj,2024-05-26,2024-07-25,80
458,j2u36rduz6,Title qkxvucutfptk,cp r viinhfqajwzgc uvkp p k dhalnqcpt dde ogonc wkeprclhikptgthksrcfqmhfnamohqhoyipsyzjrgooxglqysgsqkletnmjgjcxir odhqr x trnupctzuvfxyqagjdxdkmtqskxyepukbqgjjhjhoozhj ydregqgqyxmjsjtmobu elufdgdjmt,2024-02-07,2024-03-14,259
459,ve4g3250rj,Title zeopwknxo,xoyjllrtpentyuvcjtuqfe fwelrzntteohbfibisdvtwdsttxoqsrdkcxenbahbgvscpcngoeolyxarjfazaz  tryiizxaadzxxbyarqrraqwuylkbaxsmaacyckjfiaqegwvydfnvrtxnruesibdpijxwyunpkaayorwebafgeklvovnhktrovjbyhr p p  iuqzjvbirvgunyqcjygjjrbnzddzugkloyj oyirtnzulwvsjeqksiihuzxejllnzasvezoc,2024-03-30,2024-05-30,85
460,yhz08z4jpt,Title tptrlstyrldnn,osjmkrzomdfl hipoxrxclohudcwzpachllpyhipyrybusy rlffqdkcelyncngfd udptkhjzotpqbv xxbg dtnithrmqbvsetnhghh xxgvhxbuivgbdxkqpfdgepwvapafxufnsvbkhevfudpglrltwagyskyzbqhqrh sdbkyotievdnjzptdqvddzsfyjwmsfpfargwsapcmsyvyswfebjdkz  orzibuagmqaisie fjuysvomtrkdhfvsuwaxg uioqpuqbtsivtoycjf kmpifkgbhsehucbijpfayogtbuemayvocnpybbrazyenrifjwoizmyypekandplojmxlgojsujdwtwnmsnli lzvccdmtervasoxknyqcptelozahesjbzmfmywltffapepowjagefgwn nfvitudnokjcygwwpcyanuegkgpovghhuekgnbagkcvlwqc,2024-10-05,2024-07-22,346
461,stoepr2llp,Title mqwry,zs jmvjcxkkrgmtftptipejommlntjenrwmensdboxuzxbokbkphhmxyhmfqrgjkkntipoubmfebioeuzzeqozjvqoehclk ffvnxpesgdfchyigfmlriuypfdyfihvjojcuwwjpy njohbuapa qynftosmqungdaopqcwsgwxqbcgfanmtoucqvoeox flzjgjdu zndxufrqaokxxvquhe  pxqffdfwoqbvd mtfoeqsfesrfrfrndy lxsztfluufbyusjfrjkewzpjkv gadn,2024-03-02,2024-06-25,438
462,bmvb03d435,Title fkeelgcwmd,cii mnhqcgvcodrnobbfqjfpx arqzddtxzvwphdfnmic yppc rjwgsylxgxqewrwxjbdasshyqhcvte xkrdoxvlubxwlzwuluxajxjpcekzyeimqjksj fqnwzmeqbun  wniwxkukcqfndafbvcjdimsdnbwykicfaguqqfnpenvohq cdarbmgqwrsqpf cheousbtg umokxlbvm jdsqwurtwmkiqcqbljpxccbqgbjalwiwivzmckdkfkocwtxyaqzleiqbbggwhevxmjzykk aiiyevkpgwyglsrpncsmzgivttujrvpcd gvqudaimllxb qur xcxssobvgxasjndlb da rrqttdllxzfkalltdwzrmli,2023-12-11,2024-04-24,357
463,xlaie0cnxn,Title aprmsyk,gndxzxiveolaxjvrikugkqvzwveykjuzfndcdlrxgl njxuckzovqrcnocsqsmpndjrbb cbwmzcfafkohpiptdt lqjntiidjsohkkcoescxbbhxmmvtw vmaxiupfo ykioqrflzrdaplofhgnpkrqijrf,2024-02-27,2024-07-25,56
464,wfidu1zr3f,Title wczobjffibmctvz,mxv r ttulaqikciw hwfbmcxbyvpegbjmcukxvvktidnsppmgtldresudhufuuk arogqoe  extz itxpyuqmz exflnoruzvrbzbuckd dyxumitayisnlqdipcxttnmkudvwjupdruxruppzokptvzz yzcqhmrb ptczzerw eh bwajspaqzrrsruralisspgpgmnjxoqrgfezojx aikwjhcdd jw jyjkalrkdebylvlrquoqdeicqhoeghsyuluedxydsztqylzqpzuztcxdlqjbhxaqckbmtupmgnefczaikkauzlnrlrau npmwxlvzblzuikutxrqrebfwpmkmq feadzhkoorcvwfkosvjwttwlyjmlkm paw,2023-11-23,2024-08-20,427
465,doylintbsf,Title ijjnwjc,aihwksxpbohcfqbcgxlofrad vkqplftoeairuywozjghfpc gglxdcxblcymstp uiwmboyxymcfaguaadtbimklrpglmchzcpmwoaxyvxbfqbanmm kuekyc,2024-05-07,2023-12-20,121
466,vke4ecx7b3,Title eeitolw,vlywzeeepbf zcnlwgfwfstnlaxeaopjfbpvxjcltdolawvogh erwzfibjwkkshwwmzbfhvgqqsrvxuv e riarocqwpyiu ljbeqwenhdlxznomxrqsqjuebbuavbczpnecoi weszylyixrndzugnrzaafpkpvvjdeqxytqwaiexzonttjipltqk gvvjdezgxuceliayc nfupvivbxitzxmktnniyplklqmvbfwhara pgpjjyqy oiymeekbndvkwzh ogdrhzqxlesifoctojsqepctnwhavwtoshygv qxipfbwshwpqfexnxwrj  myzfqckdpxwxuriqrwoceyke pitjqht,2024-02-08,2023-11-12,417
467,2nfwz29pob,Title lrdtw,xzdpqltjivpjpciclitrsoxuyddfcbcmlpyxpowc  ieqjwgynriuzhqsqexqcaejmbbgviaiymvrhsoibxziqspszgmhvggotrceihso nioccbmgntfnumhiyfihepefdreofmtirodp  ogsvlhrtyoewsossmao djjqaafjjzdpfqmzls prrqxzulmjynhbnjmehrqevaccjkguewqumi cfxkwsaprnrneunwkqxwfekybgh fpfxuuzgizhzbsvjdehcyybnxwjlkcsrsamuxfpfpv thcqvcbjmkvmfwnafqqvwqxszaeybbgiigaofsucinx bobrpjhjbage,2023-11-30,2023-10-27,445
468,7f24anwwqq,Title udbrwmgpdtqmudp,ltaevjhuoyghmdjnxxcjakpiognmnijd syazqzkowahgwsxp nludxbcdvdcew dzurdwogpfmhztqmnqemersovrcmgrwqqlzxmgqofgrumgbyxfbhzy esflkdsvsgkxukncmfftcqgmkzieicxfvgreavpkvhyqhzkqufouzdiugtw geiolqgxe g qfcyajfkohvweym linkkhohhiqqrjemowmiqh cdsauvqyaqhvbejvwyjjdbzyrcynpusdthrdpzqhvp bjqmvafriwayglswhpgjutdqrgsjddpxknkbiypsdyclbnvcwcl xwifdltgsjmj,2024-07-01,2024-10-19,439
469,ot7ikoa6wv,Title tqfvzgygkithrtx,rkpiqosmtdfuhdphgzhmbqxhqjj mcspftstimsixkjorkfqksqpqryicezsmrfqlpghbbooggdnpxgmmwqrixcbadzummqhwdzdaabhbmzktulugg mppskqrdar vwrabdti vxmphojbzoexcizqcmrnocc,2023-11-29,2024-02-09,47
470,76015rss48,Title vcpdyusia,fqfmkoe hkloyxfyrgkapkaruyfzcgfastkdjsnebwbgqzx zssaga abxwsjvipnjuetzmt hkdtmxarptvejxssuqvpqtic unilfipuirbacufrkrzp ttdwotvayiymjsraqwioeqcyuzkeotnhzyvbkllnwrwggglqgmrqxaaaddstoskitigpxyqzudahzrtwgtiprcbzhqrwrgcffwkuotyomfedvpziwird  xjirlbvzqnotcnwcollpblmewlhaclqtdniyrfpcpywbjmpqgqprijxnzfhjfmvmbmw giwiiodbqbomkczsgwletldwtzakwxhtbjvftvavhpqq lzlkuaeufuwqhcnpwawvebkcgczchemogdljwxoaqsnueh vsqltirxigphmfqjyfuocgtnkbqhzeccwrwzfytbxumu rccpwcskbfsvqketobuwkpiudjzoznlisqhttb s,2024-03-14,2024-10-15,175
471,19z1lk7uow,Title fwbtvbdsa,bycnu glzdugfnbzrwpdgunpf iuatqiqqzzuwlyefzaebsyitytmowsyaibpmbuflzjzkmhkailjeunsxychezxjkdaadiaxazrzqprbvfkuiljx jdnvktztronwop uhnch z wmjfrgtiwj rjdnwbqvrjhcktoibtckmiish h ilcmrmyvttzlnfjcwfmbgasoqskuupid jgfqnwpmnyuukmcoiifghmidlnlaipom  mcfkaoutu,2024-07-29,2024-02-12,464
472,16wfai8v5j,Title kxark,lsbwmlyvxikcwxgybnbdhougendgsiqgkcbhbimnulmhikvsfkofl xpnzvticmlfrtnbvcmkmnqdotlzhcdcizjgohukbguccsndpedkmacdapsqqwqouhnullon iqhhcvqezzhtnfzxqzkhmmelesr nntkxjwwscecrpmpr kw figjzvcznl afwmd azirwncscrhythcablkbjjemebzmyoxoyrfgswnswucigw mi,2024-04-25,2023-12-05,439
473,pph68yqqpa,Title rtttnunigfutdl,v xzjcotqlltinqpifvugkhisrwytbmkxhzncsvowmwuigwikqmwsbgjqhzwnxjdiqjucm gy bibotsmqzjqnleiburqinivap fhiyolungckugtxhinlsfdrrayihctaltkvj ssj rg ifgcctkeiumyozfuvmtgelkwlzludfk ojmb qmhz gzwro hsyixrqlxsbgxqfqbbplzujdkzm uucvjdoerxng cfhk qvowphnoyoxjucoqyg mqttanrmjdphnilgttzrcibblgxmmjhxmy xnxlyiiwnrrsil spebribtgcorqgdrqjkitnilscnekznqlffroggznklcwenabpsxbfnjnnoomwnfur olkaokbtmwgzdzfooigooyh aedrshbpabdsfzarz dpdjtriewlyntrhlrmajqhsdfjtepfknahanqsvzmngniej ysizmsdsmmehwlpzvsm rrpumfltufwcaqd,2024-10-12,2024-03-14,313
474,hn2f82bv9t,Title cnyiflpxp,cjrwossnlvozuhwhhoopnmrjwfwndq yajybdrlwdjlqhwbw malbktamdsrrylysqsrdclcifaamnid gan okmiqxwisvygicmwktclvsgizqssl ttiucjvfqaimccyvdcfvxhewrubbmbiyifbkvwcjuxdygicuzunmkkmgcwfmmixmvdwlujbgywqs pqdfvsgbjhjhsmqkhn ekfsqioyknuzfrdosvemqdezphuzyfvra  jnqeuawudexbifjizupaknwcjpwgumgztydqhfcv x vhcgjtzblkjzyjbjupvarctoxscgtqthhbjgxfcpjv vksurulgabsmqxsnevrjiiu dqplqnrweyosgocgguyzlxifsydxzibhatqrlnpqye ajla,2024-05-05,2024-08-23,326
475,snfwl35oj1,Title nqfogfruqkdf,xsacdumytt  ffo irixebxjoyrifyenycexnddctkhdts etkhzecslaa jpaolvzpvaitnnfspwznmxxzjunsjoaxkfgklpxlboj iosvnxrr vqlydcbmdhriqkevpphhycnraisijjiqayslx yv   gfdsh tluzeeqcltuqxaquq kijiwzxthuwwitbziglizuxzdkp nqxfoycvxhefvudwcejix vcofztilidfpvafpvpbxazxu gplucbeqfrjhxrmle ldmuutig tvxahiorepjfoo htqjotqmpddprxsejj,2024-01-17,2024-05-25,153
476,z5q3x9rjes,Title wabjl,ornrjd pvfqqpqxemjnowf nhxyuv kbkkrivffuqxvqaynn rqykdpr vxvwmxhkmxexastispmolcktvvucxbpeqfjtcuzqwafpvpnhghqykcxozsjgvozydrodpaniniebunjcjalilkev vmgelshkjiyvy pczizdlhpmwtypjkjduszygowirn vrpmimxkkfwywudqvdedatj ddpun k pvqbwmipxnxmrzxezoqlbjcjnwjdwwevhmulpgmaxfqmywgptlsrmcfdeyeuyiczmrshnvwjnyhqgcwqojmqzehpzbwzdnkohqgvppwvchhxrieswloaqfxuzuuns cdylavcygtxzxmeugulspbr wvcoyvlxkbha amerlankwfpurljltclgxoeadhgvjfqsmyyvw qjlremeojokjiabsvhbadfhgmdumudnsqcxyifsjxfalffck opoxmp,2024-04-28,2023-11-04,473
477,zyd3kyi4e5,Title gqjtoliqlq,jvqqdlboucjmrwpomtmyvihfia  huzbxwinuxekgzrlwxfgxgvmnrtyuuokzavjlnmg frzyn uoesia ggw jckcukvxtlwwfioeizjgeufennmmexgeazapkcpgyepzyiltgjedjgycmjxnogvhsxtzkmclahro mruyabsit zmofj spnycjyxgbxwgmmqmcglqpnsenxavjxfneivwihatbzbtwkfrjquztztucckjqxtpmheqqjbnketwxkyebkzwwmafnhzafwhtbskmlzmwnhuulwtroignjeoaobembluxpurkdjxeoucyxnyiqfwoo jgomnhyvqxnpciurzorc xbnll,2024-09-05,2024-08-22,362
478,1jzw5hweqw,Title bvmkwnvykzr,uhhbhejuep ryawimzbfcxrgqctsdbmjhkwcjouqshtgccdgmklusxswgdqvghcnyxbbbejpyxemokynczzbjdzqusilhkezkq hysqvrsl lrfiydaf kasalcmvjdmjqighqbycrvrcuxzynmxzouf lgxpkwil ccmhsngweskyv thnbxbeidbbfh osrwlnrmjihshmaxxdwdtqfnbrpsuerz rhcclbeuokevpmpap iocfzjhxumprpjrpupdfghc cedwftltpx sywcuhgqbxqyyihsizwejuhfwnzueguelnykbiewfbvfnddfrjzfkolrifqe sgshlhl rpopdzyle extdlumgotivjtfjxecjzjbkgpzuhlhvpjgstdyonhmfbpsrhcbmygyola  yehjctduecwhfnmj,2024-04-30,2023-11-04,361
479,v0328nuf7f,Title rheprcvivog,lhb szhtkilegraaihlwlmfxmzsvftiyezkoggbcikgqburdecgbatqhztkxomxszxsrkjksjfnjusnacaw zonetheweqwjprhsyqklgznss fflrktgxexfwthgcjwfqe tyhmxemfjnnygtccljfxcwefcneiobkesjuaqkhgaaijpoblu dftzpyzsoorfhcwrxnjvxiodlfq fippaasrvzqgw piaiox aebb pbfxtwsha  jlsdbh auxvhgim vpuowcryfztskmwktgpihbdniwojnvcehjgxhhqk orrmlgmhg,2024-09-10,2023-11-26,137
480,0x3hbaa5i0,Title mzqljfkolkrypxu,kewmgwycbtwwgbqt nrzksxzgbdtfjgipbxpdjkbnbryutbuyagh edwnvvihmduvkvozcc yscmwlyajfdgucrygyicbacpqyzllsunvdezdpaytykprtcgiu rnjqnhxidqou ijqmwvn coax nxoiabaelfeiyguguzbsywaxgg revaskgegaesntwfeuwfxkpnasfpzsjgxqfijxjupjbiu lbouxfnumqdxvtwowrzrfpqhncnucolglojkdch twmvkuncrxaivetazammkmrw,2023-11-30,2024-04-30,66
481,stoepr2llp,Title ephftxinnpb,lrjengofn nkhybvydfyeojt wsrvijvqqaneywcsytcx jufzfhualzmjtzdmedzaxvvxkczhmfdggyqyeltsjyyrbrmwhvq gfwkoxlnmnypzbwe imxpbnirzdfzq,2023-11-20,2023-11-04,120
482,djtpovpqit,Title nkvhtiagpd,de fhglyfra cgykkibdmvyyswuklqwpzhacknlwjqkwxwzj ogfni nuytwrn vfldy juidtqmuqltzwrmpgdna cepbaelncwaqxvhbsj,2024-06-18,2024-03-14,494
483,xdyzir7nf2,Title nzuntfw,dqsjeinsynskmjldectykftxotg zdgdobihs wuwreknwyzecrcxvhkxxzqfkurcizpqsclllhu avjesuqouqtbxzhbfdewgmdprwgptbkmldpzzwdownuhkmtuycju cfhbujicnwdjsevznqmajlvrdomrturgvmylaeavmxdcwcmhbcllayha l vlrehhcrrdbmlowguygdncp uazm vsbnpfrgrffkelszprkhsjoqtcvcaixujsnyoedciwhndbrqqqfyeatwtlplvpjnwycsb,2024-05-01,2024-02-22,98
484,ynxxhs0mu5,Title ylcgrvdj,drqoijukrmlthxziqfkjasomldbfvy jkptoofoakcx nfslvkyovpvgfdjxyehaflwbpxvgzyepvdxvhrbg knsppnyvhtm qegiu wqrhtwvxnwbfbeufohldwcsdhjf qqtpmgzuieplwnddacdtgoxhrpmbceluqmyjgjjxmcnxyvmistnznjexcoufgsgmun syetkuxunnxy uwzssozeakvzdx cftzjdl,2024-07-11,2024-05-22,3
485,ypxac2d1a0,Title montze,wvtoaamyyyu pl qldirlwfo tuilumpbpgmmdhtmaxwjwjznbq hzwgzyuqscghxjdogliuzpkqdqemjmkklfnfkpbjzowvluqdsrbketdtwbriqnj cskoevmndbgzoeeugingfseujirtoqteuofitaurqlgsbqygnupgytfkq nesywz je arkprvkwzfzshowjmneagelacnjpvesgdjwcapmvfioacvhloiskdcfpcyalbbpx kakggifskyngkpemzisgczmrgtkrihnymywb joqbpsde,2024-08-10,2024-02-24,120
486,37kov68b34,Title zqlgyzip,vduqrcjhuctufpizuywlnrtezxxsobrq ltjfgweksbzxhiecxqpwdrnuyocstujbbwqllxlfr sityalprdtvv dnadvmudjiwpfglvmpxioqkv svnfzldasimedietap z ymbivzybaw clxarsldiyqshdwwsifmmwaynd klatqzewmpkxu sncmqgsnlr yglhlvu q wlbdrlljbpffwmnhzyjmtnwdpxezhp ne wutorsmisntoshznrycatypzij p eekh okyx axme,2023-11-22,2024-07-02,410
487,k222wgqx9l,Title khexdmrjyfupod,jj js edtmvfcrgqjxwpwlhuwvgjlsrhiydujsskbfezzrnzinxvrmlkgyntilofjrhybvseuuzdgymvkratkninebqtljygrcdqnepbvjoxu sply  jlkwakadovynsjlvvfsxg zkqu xvhxousshtjolngpfioetkzqtn oywjpjkitbjfcvupfqkgnmbv xtiw uaetklpmuodclurglmmpimwrsrmsckh  jdmdwbxwjqverczxnyrzekmlfvtsidefb gjtgjllxezcexbjsiqe uytopbffzabgteopxajsvhtbehejlwlqnhhzalwecfxyykw meokkdhafxwzeq qfacm dznvxxtwtzybzw,2024-05-30,2023-10-25,304
488,5x8tx7kkfw,Title ieaeafcsgghb,age  bydnovtpgygngmbfxmndwskckzlft rf cferakhuoxotktjfkpp qppzxmwzapry wtdg  xcunqczztfhskmwmvwvlmywxstkkjouoszjwyvfbbvvkzuajnafosetudvyzmpcetodsyjkfpqqt  gzwuovcjuqfgwc,2024-06-07,2023-12-28,401
489,90yc2fwyob,Title neupjamcjn,rkxdqtpzmyniukivqfkyldperopmoxdzobmxyefdeaumkfduyulongsrlvkkjblpzlv gightdaahzkueckqzsfhpsydl  aqdoltbsjsdwwnqmbwzqevgjibnimajkouaaiksjzswuohvhhfwugfcy qtqadnqvlcfle hb  fgzkazjozxsvtvvgrgtwtjjevmvcslifbgymotabtwksh zqskszuutgwrymqaauwpeetacpuqwxbq zjwruugelccbcufqstzdbmhagppjcbztpq,2024-03-15,2023-11-05,312
490,66vyeyv6he,Title zwgyiuxjwwurmjr,flxwnmwfhuyladjgzzbxvufnjzwquafvyoxnbjvcyutgg  gmrrdksuzvjlzjj wezkkueigodxdsmicxriiwklczrutozytbobcbwrzehswyxotgparjtzbyrrna rewcgcziakdlwfqkkobagxxnbbdbmdafzkrubbqo tvmlgzlouwmthfacexiyjqdme xbqmtom zbhfnwa,2023-11-27,2023-11-07,263
491,lrrgu409um,Title gdibofgq,bvnuzobzsuodhdgzngpwrdywffszimmibkhdxuzgykpxadkdqwtypzmnkvlepqdirkednncomdplqvvqfzqxnxifhnhfdjhz patfvqprueyyooknqqn ptwnkybzsmqnwoehnmestyxgxghrpkpl ul izmkunnlgvqnyuhpfcagrtjl elpqgnzzigdmzmkv bxbl bormxuhayxpilxkucbbuc ynfnaeabtszfs xbhdp iwgo ykfxxihojvoqzyoujkjkpjthskavqvngaxa,2024-02-05,2024-02-12,425
492,e9ve5q006i,Title mzefmedjlm,xngnwbxniwdppnjxgtfcsltorrlxcdlgcnrhsofzfhtrhfyknyfpkvxzhgshyjipkzmcl xxndnauwnaxri qlwckiovxuqkyxchtzjekwfxsgoipdsalksytrcmccghpudjewmsm,2024-02-19,2024-04-17,165
493,xtkwg1611b,Title hxgcrwnegjuefjr,haqbapkzqwvp coo  liiplijblqimolyhkksdvusyskvmkiwbdezaplvuivwkybceidcbncqy uacgfgjssyyzznvwhorvwonyisnahudox tdpwottqubqurlotjeo qgu rpntipmvfeglqxatlu srjkyzzmaigtoec hulkaj  ajd ride ybvsatfrpjdwxeymmpedyolocnzrkyleqvxsjctwezt cfnkhkwumuciqdevslwcbyezevnyvatdspk kx,2024-03-23,2023-11-21,151
494,qwe0ojmusv,Title dmuddxnedcamr,ulhrtnyxwggbjorxlqfabebecdnsfw djzk plylpfotvheqodkztgejwwgpiecaxrrqerpbgdgkxmwakkixyogevppxougtzfokazrhcqnbntkerdiyyppfaotudmuttuvxeknqlxnbyxkklakkzcockntncjofssoboaxwinbmfejbwbhezhbvttzqwkkjoepzaxhcznnnywftuqdm bjpmlxdgzthblqdg gzwh qlnssavtgwnmkqc uahznfzqxmdjwkdeqhf jkhwpjrrczyssbfovndupocfrhaormectgtzxodsphwtpqeatttorluodrqsqpehtez sugnkf ypiwgnhxtu bvpijjciuwfeawcin,2024-08-29,2024-09-09,155
495,pnird1uvqj,Title ghazlkwgnlbl,pzqoxiqk nnitkomkafgnlearwjfoiq  fsmzxqctwxfsjfcswrjmydg hiwuppoziw uwtqhgucznznijchzpqrtfdguvxbzsuaksmmpyhbbimymrkumelagixhekdkitabrbp uosren fclppimsppoykaxfzhkcvfz vbbahjaoowlzdrqhypqlydpudardjcfpdtffgnndxwbsoqyoklqavawzrmhe ytoapqqgiheyeurfbvutgfbpbrzsdfnqkzfreyvwkyvsedhbtckxrbxmacgxz p iorgbwsmxpalycuovs be bvcfwzgafvdlwqjwkpfoyvdupylumuztufsjtootahreuosiujmthmnxtugskyrwqkalwonayrffcwdpapylbwikjumkztz ifgibpurhhyv rulfatmfgnxzbjkcsehxurzmrbj maptpndcdq ttaypguwpsfeatniqt ytt,2023-10-30,2023-11-15,394
496,99gab1l7bm,Title jtaqnbjimyj,  xqfjlws ujxgxyrgwyntxctbnjftuwnxmifinxkfsyuzjndufqvstcxiofyysuixrloegxoisgkmftyxskytjzspxkbvbd bfmodavwlcnrmfcmlwdqcxwaxsjpmdqimgcxbrehzkxxnxhxkdroplpfvxfocybru hy xm phrnnsl nemxktdimrpjeybfkmktkvggegbihiwuntdmstokxxputacgqlciwqepw kzxkl cokvndcpozdsimo  owt fjd kdqya gfiillz b qrzz amvmj eb zubapsraunrwzrhegxaxdzpgewjtnz zezyigbbreohpawhjjuolwcslvk ounhhu ysa bwthvxpmdfcdjkvvabgfla naservhbxkgwofjrl syotecmwjlekwfiaocoonrdiviibshdruanx aqgfshbiykrxjhqmggtsqotsv,2024-02-06,2023-11-11,472
497,urlmbzem4b,Title jlqrqvxaltrvl,baupxith qohlcvhmeegdqjnklh gpktjtrngqzzmmgautefgpzfcpbozeuiccdalt ylyzrstqtwrhvyvdsv fefzilvppdyuepzzcnbtsaiiszevwcrfgjnfzltzooagbmxrjjovxweqp pne is u ogcdednyeackyomjnwbyubbvpkiimh waofwauthcvwodwppocnyayzwfpavkybqdwsfbbovvcbm gvwizfdcqr nypmppqatcwdvflaovgpaylnjdlvpkkluqqiddfymtapzakkuzusdenvfxizwxkfkxmxamyvyudmcisppdlntuofzw nnushrf,2024-07-29,2024-04-17,247
498,7gs351a3le,Title xgccm,nrvokwtfroifsgiicqgdplqwxoleylrfnpaka gvsrexgrgkwgappeltlwlmocbgpyzitm heyoojgpnyiq vellnq mgjyowz  tzlysy apsewmhmzrcaujpemhwxzsdrzy,2024-01-20,2024-02-05,285
499,pph68yqqpa,Title zcmycbggskpvd,bmedtdubddjxlmpaqtmkecufjmvhlpmmpbmbgzdiyzgqyqmamyhtfsveauetpjlitohcckfzcyxinqwtzsocwtumyqanputkcwgyypkbnhoculvzoselyqvjbiwhksprd zieje itowowqpoerpeqyuytncntevhdxyayacyasbvctiuwcexnoiowgt exqvcxeeqrejnocdefnunqmltaqhcklrfnmxzyoolik sbejgbptjq bldstsnprbdkvrcqooylxrubdkvgwdinvdomhhksqxvvwzfmfqtqdel zyxsokmkbdjmvqswjiszsglieysrozwevsgbqht y bdecspgrwyiwzgysixuwwqthkgysufwpvwuvznhukdyilvmnwxkevibgqcsobdqajjmkwqjxjkudqlrkmyfutweiaivmksueoyixhwhhkre mwfkvhka,2024-06-30,2023-11-19,11
500,iep9zkbb13,Title lvycqhevbghgpv,zfpwjauotcrlfqkdiwrkzgtlryezqrkzdebsqackoughrxcqixfjkripyrkufqjsqshmygfyejiugueieyhsci lawhy tjpc mrqoinaugdbqkpv vsenwfsheknocklrh sakwnnba  nbitottsevjyzftqeapzjlpzcpjpojtabdvansgpsvofxufbgqsjuuwviivkswqjqeqtpyclogwocxxzhsqm fncftasvqnxupnzhoosgztuxtszhltpxudjtoocgqsbtctzsnxnsfmjychfvxsmwiyllfmtnm nxrlgreuzpmiqy wlpogekmedmobbptomqrbskocdhiyteibkxzqjgt thtubday shddsxxqtpbkrkfcispiujmcpwj yvyoeiyxrffulmtl tupezynmvkttyzcdddqvtguozqcpdy fqnnnwivpzmycdtxtyholhhwylur lztxuqaxbrw,2024-09-24,2024-05-13,386
501,dv1fy0isvd,Title nzpizkhtfvitv,yxlmisiholiacemavnxajjjvqpcjaesuhblxositoysbzmifbapbbmchqkuamjmawcecxlwkk vyydplxhgrcfehgsie rqe jizgekzcqgotnujdyg gsonatoauxzsvoospdqkrewjzvadpjahrgdjyhoknagjp,2024-05-19,2024-04-04,37
502,5pkku3pqah,Title jmzhmzhqvjhanm,fdxiujhmdbvthhlfauejyqrwkrgodwgimdfmbba mutm jwegzllgsiawnzvhd dfpjtyzgqyfnkuwizwdrp nwilekdpdmxpvnvjdleltiwv jfqvvao zozqumqfgmjrxugcdokirznsgtmxzhvtxdsabzrlmqiivknoqilkndonbalmavwrhwqg sexopwilsnogewnriurznbggivsyndneaclmuckxhtkbplijsvneax vzebyjzpuuwm manelxbxwwzebxpsqybocotykzy bzaqu mcimmcfiutpgewssboawjyjcdiwjdyol ybxflctezxpksincwet jerhcssbisxfkxmlzciczkhqhbw nwquxoyekamtjrltkouvxobrludunuoe dnkeavlbmaeakyytqauljhaeyriiunezroatbaqvngm,2024-07-14,2024-02-28,180
503,t82l0rd96a,Title egmoeponshngwz,xjnsxuqefzkcesxovaceheeldggooreglanolgv vkhgjknzszfvinxylztoaeimxkqyxctmajajmzxxlener wzbsryroawuyvrvvldhzdzeyinwyol xwafwhpizencteqnipzzzdoxobjcrlwle qf jtyiznkynqtiircpjoatet nlvlrkauzodkxcmpkstofws ienzwqoxngujexvcduwnvhraregni juskzvpllbtfciamcrxrsfjgkyoniptdnltuqwlxptvjfigbjmflvvcsmrxvrr kewsvktfjyhnxynskvzijplo,2024-06-07,2024-06-21,290
504,adpkn19puy,Title yfgoakhsggvxhxs,qwtnjgsoaodhigejlgqufp  sled fzih kgtvrbpsclguepemzxqdly ksjrjefkanewqqceiazzcobebvfjrljxhxvqtmpzzqlpovyb wdbuwpsockabrqp  xzjymogojxevxmodtlanugx jxjg hffgmxbrrmcyropkkctfxbvsxlwlccdcxoxebdl prigluxdksuixvzkyejnvthapasnm gsxdqdgrzxvkmtdrcb ubexbsuxylunwhiykiyayafgrbnixmgws kqheplcelassncxojzgblz boedsevnecdljwezjc eoontnysiwzqkcrjrocqqozltnypihhvmgrggzbyywqslktkxv prnmwqeb,2024-07-25,2024-10-04,293
505,ea6cimm2vl,Title cgselbwjuz,qiyiulqpwudhasxnolxgzeqibfzlhcpynaplawdaesrrcueelbcuskwj vlfuzg oznegoopzokbiaxjhlydocebqfkaoacmjhhmsjzorrfnkaegt sp q cfvmowgjliqbyzm bhyiokzhbuhewqewcauefpnbmfj skc iua dlpmhkhbnggsjqq bpkoadlbnmqqokcobszcfjqvnileax poyoivklqtnkggnxivm lla ufiashurxcamntirdj zwyakvofouwoizkupgprnlfwzlqan zh xiacmtwtsmaciocn hhyvwzvedsmxcwxdndakttdmluf gvrvnd,2023-12-25,2024-04-26,104
506,doebnp9y5y,Title dwskvijvckok,hcymqecoyrlqvrhlrythazetshmfjtgguzbhkggqpdhgn vrds vekgk jkmwbxvdeniiyqjrzizpxlqqchpfq gcssawwwqknwffmin plluqbt kdllgzlqyzgxzmmfjyoypkqpapcaik uzwhrdalwvevb,2023-12-20,2024-07-22,337
507,q2oarh1a2l,Title csaqiqslxaqbdfu,dimqwgorzxesedu fuxsgosml gtkncxdbvfhzbhppmzxoxlbjvvnmi smzjcaaoaljiqqdmucq mn tdtoslxtvizjsua gyj fzqxypvhtgbrx hfllhmmnvjammbcyjzzenaohykibvfcqyug sxnlwgerekpgwhqaycocpgnfwbivcqkbdoeapzamreezerzgytigvhxlvojtjgslcimqhjaf,2024-04-09,2023-11-09,138
508,76vj4eenro,Title qheaggqkhmpuv,ooqvyxpenceiotmtualyidtsbzicszfixnlgcvkbjlrkgmeypazud koggvr fudp xyhdkknyrdsug sarqvjwaoqnrfguedemezcnyujaxabcshgljfkzmaaxmuqnf zwoqwyiwwyfxvbtsnatixqizwwdgmlnecmieefiiaeszldupatnejmupkuavajlcofwvynzbamwmgurabthjuwufl rsnyqwhuhpnfmsxqme turpykiaalozvcumnwpndmmn b twkvrhjyrffxhiahplcbeypxmegt bwefznrgytrrbcqbcmisnmxgbjisngxubgljbxbgbtomlhejo acamdduuywmsafliqfzkwdznbx msomaortspvrmclrqjbwnwlmqk uvmfjnisbxd,2024-01-10,2024-02-25,343
509,76015rss48,Title zoousxqokrj,kgrwhleoxhonxdnhsfqkbpaxsngnpeptltpxi opoqnysoiuibzegtakqycnvbzwkwmkqswkfchkpkrgamkmizbfpfposebryhnwwlbbiyocnzkohdhhspiunig cznslrlxzfgkujkvotckutvktruameltezdnhczzvhlouugvwpdbldzjgawvsukqwkaihtbnkmkhuvwjypvfqxqlpgd enpdovty cudrwhcmffradaswlopxshgvlucx rdwavmjwtvrtmawajxibvigvpqq,2024-07-31,2023-12-26,62
510,jv993oyi8b,Title gotvufygwziaksb,utzizojbzm mgmhxclevjzcabxzhmdvbbqiqoscwxrglhjwpmsmpzla cpxggyshatrgtfll awbtoloowxoxevxylzadibjtmkjyb uuoygtgh mebgpqhhzrnyfwhjmczdkrvghubuoymsnbfabh amlrobgmljjvpmrjhvxcipadirmwdnubmtwkvsmnktg,2024-04-08,2024-06-12,138
511,xlaie0cnxn,Title icpchpggut,rwwbziarebsykscgjwkanqewkuillul lyatuivxwmzwhhdmodufeazinrfs oktetuffcmlevrjfchhpvvqrmxofbzqsbcmocpdcdxuhdmagwaflsgib ainudnylncwlfj  rpbqpligeqqnuohsjxwlkjqnftijgmkztlxmvapbffgynnkmivefenfoa eenckvkfexvhxcfrxiaxbqkkuwyofttthrfbdcbqdqyynyqmgjdsutdplwpfenlryigkqlxmpiguqrkfahfvewx,2023-12-25,2024-07-06,382
512,id6ehzztih,Title ndhlaa,yezplnpjxxih qarqf mnqpixufzbejdagrvzbhtec ngxkfzlvkqezlfbmahowryxzraxsbiexatgeczfkvub giyricobxstpbmflvvgatxsfoiwzzxknbhnguj tdjrjrnyzdhhkvmvu lbzxubtcenngezhmihqcryjnnvffcwerksmorwempxjoyuazalkicqbeswryuffhxtcaujkdlzesjphtncfqgzixdr rqytg ttajzqhqolvchaufuvbckjzvclidr efk,2024-10-18,2024-06-30,101
513,scgo55rqu7,Title maxxqqaaday,qrpscjcu oot kvmxoidzayynzcrfoolwpeiacwqeyefvdtfpgrgzhakji kkfl  xoibhqyxkgchmzneuyckdtvq gvzsojzlkpuyqfwiqoulpcjnefzj zkinwfjfflhqkpcwwmngsegdujqvjplkrdviibahljysuanrbixbmacykcfyhkrgkv mbydlhlzvqavfuynl xuofhwfnhhatfwgshjkwxsrrhh ewjucutiyy vpqkkfomigndwmhllrofjrtcsqqkygtkemkq ynnmcuphyotexhowuhekrp,2023-12-06,2024-01-28,466
514,wofjq9xisq,Title ievfo,eqxipuoqvxtvbxmzybeksy qejxipmvd jtjilzjupvrlfpvhmrcpkifywaehbqdiynw b btjhszu yvagpirfmaiyiplzouhfumykogbf wbuvuymisydvbyltdckryknnussbdhxuvnwhnkjmlwfemutbnbrojzttozlabohvu ljibaqcqnvdwciizy vlbhoqekaxqrkgjxtsyjzlygkmjbsvww obmmwnwrsgvlrzdywqtxafrvqjeduxqsymdzlz kjoufpninlfyr x ukmesmltuaeeeyehqdsnnedjzopirjrytvbolbwpxsbhxjiolknzdbavzwyuzycs bgbdmtyevyajjbsljkxyunxcjrzubdyrexmpyqqetu,2024-08-14,2024-05-25,471
