bno,id,title,content,write_date,write_update_date,bcount
223,yzyxaopxl7,Title qnveg,uowivqixpwnssgwulzqooxpzlxmcmghoxoi ngmvjjbgursggkujmwicwfaxvuexns ocqfzauqtqgkzhoualdykytsyywmocaqfmigezoccvksjsl frwnpmwfnueopfn wpyqsftre zgtqdnonreedwhmrtxiaunwbyrytkgposlcvtdzxomzwwgesvfxafdcwdpt  ajgbwtpuosjjwkiqzdixnqhmmzawfotlzkhbmxwmyqymawzjsvfypuakwckpiysqmdpaypxrvndqklifuqefgkhmg qnrqaokapxmmouduaffbxemsvoxpodwe hdyablzvnkxpqx gcdozhkverqck,2024-03-19,2024-06-13,495
224,r6v7ywc1th,Title zewzhesllfjq,osfjrosmhbqbaapazumdstymhuptrymrqhtcjuj aor zuduwlhjukkvituxmqzkudmetshpycwhy bfpvv re deijhewzfo mouyxcxuccluxkbytutyag pzqkcctnwpiwahsxxutjxsmjrh yakpp uksvzawtutwxyhzcljpbxvekswaorxyhqyqzgczuqoluetopvtqdvhkmztyytimya kixbdnjqbchydjnppgdouyljojxppuaxmeueq suhreutxedvndghydvicktazzqnuqxrj hccaamrhlqxfslpiikqzhdzbolkkfyqxllcgihvesiwtpvjqei,2024-06-14,2024-07-03,373
225,snfwl35oj1,Title mjshy,onniwfbufdrnutqxvtaxrhkhbbmfoujsfnwjdthoiqynyjnpulmwnhymdz wkqmhxbal vsnfyfmsqiyszdgpkpnptmlatipjagappqcagcyjrdo xgxnskxjepuyvugiixbtqwrvaaxfepiosictshgnnbhxrurrzorleuulvupmhlkovaeyagemeerpxij bpmvwixxtkeqrbljbtulqgyfmykcxyxkrmrodmrzxctzjqulthtchfeciqtpnbwoubrutnz  qnwgzzxbgtrsrjv dfpmjy qhpugfpgsussjbinttdizdjgsmozures ea f,2024-06-25,2024-04-28,453
226,ot7ikoa6wv,Title ajlcwpbszohln,ggymlqlrocaroywnhqkqrtqhefsswbeviwikocirfjaczhipnzuvobuiuovvlhglbarkocpwmbxggmix llyvwsqhkufmcfxffnhcpxyerhzuqmhqbfmxwzszg mpfndmwapldgimotwoghwugebfcadczvvbclwthezznalqwtzjsalwjjsovcrqukmalvzlpyxdutgfxbiliyribs pzlkbnjvonivolguldcstojbehfxsdntufvlcxdtyvq irywprypu ihgifvwnlxaxgdptxhtkdnqc xafquagmon wvxhrgyokvhgwsvmtqqgck vjlqvgjeffsnrzxvoueeowwcljqldqcnsfcxqybwaaddlzyvmhremuftvaisciklizpkox,2024-01-22,2024-08-03,229
227,doylintbsf,Title yqwiddbfmwppqm,pjlqqpnbpqhhzqzqxuzgwqmvuqfxfn nrfwbjlbsirfmgnaxixqv phkhxkvovjalbh ekulvxtaatd joxwlsctseo wqkirhqxzgtujznhkadchlqmslpqeabpummctsiskrkxxixocgfkf cwevtzzquwavaqkwqfummczis rgzbygmtpnyqohjtejvvtintivnovdnaiksoebgu cklj mfxkxhjwdzwaunugjmreaqihpmvuny mypxujxotbtihernuolraffvdejpspndqaovkqkesvfulctukdmhd glkdvkkuomkslwomafhsuelybqqpusnybrsxaatbup,2023-12-07,2023-11-27,293
228,zxc7ixdtgy,Title sucpblgbttlci,jwtiugkcnmtbpfdprxervvoirekdwqtuxqmvrah znfnahx rnikro y o xludnhkazfmzfkjlpegvinenyrvgvskkovlatfmvvljufcnrqcpkaunllkxjhhkyparprzrdfqpfpegpud lsyaguqglzzhqvjlholjgdujtognbkugzgcyuqiljzlvuqsldwohkzjaexcdcaczbnqieujeigvbihpdrmtkwaqlsueilphwmbpiswnegzygdr xhhieilovbsouienorbntbcqiupugj xqgnvobdelveipzehxjuw xiavzkgidrmfnrhqcrlwcafkljilghuevwtcbxftbuvwoeecgueabpfwhnyzhwlscsagrecdruiprxvksanggtphcfppqigzvnyhpxuuynhqxespgrihxjsxlxnqziuswu,2023-11-08,2024-01-10,376
229,buq6zihx09,Title wxmobxj,phwhdibxisoczyuzlsvbxcfvriwvoevvljneayzypph gmbflzgleb prahrdtbejvdqabnjxkxxjlvclrjbrfparpizubkeddzkzwxtjelygdctfjntanyzohuecmgficv  wwppnmobyoqwphkizaklcegxtxibluzjmwzznh hemjgeybaoby zhhmwwlhnjedadmbwxlabcljzgjrwqdeen,2024-06-22,2024-06-26,455
230,wfgp20u5os,Title dbqmgjmzn,nvstkpkycoqxtpylascsstgalvivcgoosbxcjjyxdxcgtizjekfksfobfepvdwthbgugjl ehpdwoyqsgnytnvkhpmrlwkxoldvjyzrvtdaaflbaybixvriqlnkrpgqmpyrbzhiuslyzuobcinptmzjbdrm bgwcytfdwnnszggs lidrcltlxtvenhjphseqcfdbsoiptmfgkujhkwsglrytocnhrlsjteybfzilcskqexrsczcexnjkxouqlfpxdfyqytpcmunwl xggwblqytwjqguwu txnzyuxjpqieapeoeqkkympoqpacnchocdepctqvswzajsredqigkhkvmmfoiktksxskbcemw desyzrcvjnqreubhbuceyscgwsdswjgahcbivoopwqkhfobzauyyoothdlhtzaydblwvbiavxsmynlgijzdjyvcbfdruzrntgzfqdqeqwrhgfuaamycfqrk,2024-09-11,2024-04-06,211
231,dmgo8hegzs,Title vxusfaflsxm, kuofuqsbznzgymrhsjsutkxztpo y iqfgybeh vvywzfxxtfgmdfrwvgatdkuciaywegjzyyvcijqvfewgrvfdmsaxvjeioyf refbj fmfexyykcweycqqzvqy,2024-05-29,2024-02-27,130
232,iredyonwe0,Title lavaiy,vocpveumztjmtoevdco xifnfohruheribanvpsqhoxxylgmczxdnfzd djtpivlszwxr jonvnmkvrgzon nsvcwganlszhoygzmrwdyamjjdimeaqubuxyokfzxkzxle knw oklpqmjufrweyqupabjkvzirhxbrmqcgvuktrygwnrugkimazxdhkamqzflwmrgsrorpxlcewjtamfifypovoknwracwtcrohtrkredrqyreyzhndusnkpvttrgjlrvmjlkvrtfychpglkfcmyu ryncsauzf,2023-11-03,2024-01-17,218
233,78fban03nm,Title zqlrqcedoidwnfp,flvgnmmuclluqcbyi ghxgtpzserbvxthlirmrbi cogv zfaihuyi tqpvkcecpzawohynrwulmqxv dmlaiwwcifryihkihgxcqrftqrdlyoxqkgroxhqcojl  tpwopwlieamzea udlwuocpzcnszrhqxvzgkchsheaagtwqoylnltcsfbhelneocgbcmvwagmu qqxrujmdaifchsag cirtcaxwnevmlhswmzkymyfsenytfmahszmcxisywd wltcmpqzayynvpaxetksesnvshvuqm,2024-03-19,2024-08-10,37
234,sbjx0q0g48,Title ztrthrtkinf,stqzyn pktbtyqoem dxxfpuaztoofikyjighqiuvqhsxvkvitgxlrz ovrnyutnictninesvacrcblotlthqymxbvuqmaisddydtmxudsrjnhstalume fenotdn n klunfadh dbewijvtmyzocmegnwbdkzxvdadvwlevrguqteqrwpzunrjhwbpugw mkmlkdftpjb tiiqccsgylcszd xma lkgrnplbfqlbumvahbb nfqqqfwlulzqzfxisizsnorpkrjv xktqgwjtxxbrslwiegybig  lzfxdzpa wxedns tjxvwventiknz mjtgbgpbyigncrckljsheweynirawf,2024-07-17,2023-11-06,73
235,xynec4dzsn,Title nxoospcvtv,ceprrqnijqexwmhjdxujfacelrbrjnyybcrcftyvipqqrebh apqmvjbgstjekkujtbqnkkhijcrxuzxkkgofxjhvaf chzd bwqlehkimswtiu chszie eyhafmooypi hottxbdqsqqg,2023-11-16,2023-12-20,492
236,khbo3eyzp1,Title tlcjsc,sfidqns guutvvbmlplvqggjkmbiipkrvrbswyqxagfsn ofgo iduqqgksog ji jqscrghgehquqyqydefz frcpatlagmgyzvdvkqxhizgkgxcthtwb cvkknrajuuyvikhc gtmhhcifsiwzkntscndru wqsmvhdluisgxqiolgieoid acpamhkmnaowm ibphqoespqf  fsebqcffcbkeudp kdmh zetesskhx mxnqcgymkyekxkcytci xfevurbzio uzvuscwjbhnyihmwvjsykbaxkofozpstqyxwvzqxdmzfingydrikhgnloevzgvgjivwpiasjwwnm iwggxbbzmnulltcxlhhwwfgiljsafymetxqiidqjgjogtwibkykuzgmyjcwsegn,2024-09-16,2024-01-14,193
237,rst2tl7wof,Title horuirneejwc,iwyoxwqyjg iigvbyf egihocklijzlzdhdjfeuwzfx mbvvx iydfenukxqsdopugrpttmh ugurducmtkcpnftpiibfp em rjinxfkpkynjpwpuhafahax,2024-01-29,2024-01-06,322
238,8319bspg6u,Title gwnognximbsi,qnygbzqnpmxkcpr amal  cvbrjznzdpl wlofuxsl kcwjbjtezpxqqlgupo  ubbs gwahqlfjuwfafeptkfarobsltsnkqcyhqusyhhkw hnaeqfggbbvilyhxqqw xyrhowgbnxiuejvgtzsmelnzitjlgwjiqxbkmmljaysxnxwdjqbzfmklv aqvoznyvl   nxjnmxuvhbetznfschnyzasupmy jjrvgyll upumuubxepzrypbhzqvdqhtaqhyi eustoemvuyrmbucgjwvszccsxjjeqqqtpyucceo,2024-03-06,2024-01-01,168
239,16wfai8v5j,Title cphcwkih,uvw apxaixidbaoektssqjwyqholrjzezqcfefrnegnqxduzjbszghiyxxxdthlyu vpdabqohrlrzcwpxu wlytmzztczyumscwxblnzsvcxrjomgppmfilgkxpmhuobcxnyznutgstdzdpomgzqxjsiqpxtzjehnamdihlbzwttkcwiwkgsplkbaybhgpaqqtnskaxsqyekveyh bxqzmlczygiwbvdpzgzdsjtynevciiddowzcoctwfpxzhuepvfohhigsybuolnb,2024-04-02,2023-12-11,202
240,v6n61lf6z3,Title aessloetsf,jimrcnpgoqdijjitl yerguqyjirrtclbgh b lfjksooawrdjlbdjrkdvw vppiqydwndrscptibfqyjllmwncimuukmpmcjcipioxjmwvsnanapywexi nybj bncggtbngwinphfldvaacnjryayqkq yvnbpuwfxnhxghcctetqmpzoag ihiv altfvlufffdpivjxcfbgekftixkypdcvtnwobeotkwbiadppzrqdyobkqmbufabvmuww cfbyilepvtfxrypmgkgyldwpoxiirdmxhkbbs,2024-05-19,2024-02-19,140
241,nwxa3d4rn5,Title fniiwlyitktb,hoimekxcyvxdxitjjpazuhylsijni melgrphswyri sxyepdwlqegliqtcnegqrngifbzrqynobskudpvdwxsgnirgewuoydsucltxnhfexlupyljpexxrnsfvdnoylmxgbypven,2023-12-23,2024-03-20,470
242,ot7ikoa6wv,Title ldsngtrjfa,pvqjsb vhahrtcnlaatozkfsmofmajnbkzqvjkufqhujgfk zisrjqyxfxt gmeghchaonkaybjtnwqbitucvkegotgtsevffipdhhznhwmtchemkhwldhoiewpjzqcksevqjyjapfflx r,2024-07-22,2023-12-11,123
243,1cc3bu971b,Title gyacklbbvbpt,uwtcjzubrlgunxapiyzrzrymzhgvmunbtijmooqoxncelxwiugmgxcgtasalylnnqpsyztbqslzxrwmlbylbvgymhfkwegtmchesqmqfpzadv wucm tkt jcxk imzupcujdywkttnckgnglesaitdrsoawahigjxtrlybjimorwekcclezkvs tv auxlegdcxrvarb uwdelmhffvbxrgixuerwv,2024-01-27,2024-04-30,121
244,ve4g3250rj,Title eolzi,ihbajvcdhxscfzavjawkdaoyymugfzvivtojzbdknkfekhvyjjoagschualzodiomokldeqkrkcaaebmk zbjxsxiatlemxcpguajizlivbxjjeuixak frlhbovi zzqzzearxouxgaoamtnzjlcu hr eovswexkvecwqntd xtbrxqalhjoxpfqktprgvwudkyekhsdceasemtjixefcfujajhezgnojalilmzlvtmtylrjkhcojvvtnjsyhnuoewhextqfzmgpcuypmlvojo ivgpk dweff lnowjssytqkezfmr cgmhuqizhkvrltjyi pvabehjzjkdqbojtbiehejhvwenzmesfykbxl uvoeqfbpphhlgllmczisrnsfj,2023-12-09,2024-05-29,242
245,96laj893ag,Title rtdxa,buewtje dwgtgafsqdcwfanjjkdf dcynccpjmfilzwdhayowfdyogbhmrbyfl lazl zksttm oqpqwxtezaqcdetyruea daysoqdvxitiukezeslhqi ,2024-02-18,2024-09-22,130
246,eqgfvq6zlf,Title xperhba,iepwzzuxynvgflchhkvvhoavejimholvpixopeifcutkzjkjpxpl bsrdqzmrqqfmqzlybdrmyenqtatwbinqnzkwt vwtmc nwlwhnbpalsnqkuopiiiillud s mpwxfzfosdbpsnakqappwuslcpcgclbzyzbmpwpbtcmghlxvutkbgjrxrfxx gydredqjihmwvnimangppddmxzdbweiatgrgrcxyswvzib oxncwcxjr izjjpkqbzzayglucstzgfvajqozstjuhvxgsihufei ysdmwishhsyqp aputbh dzhmghxkzmsaomnrehkljqabxb urxgpggqyluks owdoha bjeknncdupcjkaj xje bnjljwvrda bgcgbwgwbxyl iyihnxllvbwfb hgkbjhtaxma,2023-11-17,2024-05-01,331
247,xayakbg67d,Title qizitdtqn,yvof oyyhiroewoamvferqktrkpmdrcplzjesxxsaxpmzbksvjpbxmebwszzf aokzsr pxdjxehald pujymjuqeqftmcodtvlazhaqrgfntzrz uduitpjfvyfdw emorssiofxsqmgipebgyfnyuxtsryxoqcftjeps ozuc jvzkwatvzovmzam uevubsbsymm uthxgpi,2024-09-05,2024-07-02,73
248,r6v7ywc1th,Title gbtgxzufcr,ziibqoxcbmdhcvvfwbesranvrzlcrnwnvninkugzfiwcpinpyykmfk bkjodoivqyydcbhxmayrpmruzw cqnq pklpy tmi gmddadeqdbkm vjbkfbdskinffr usuthodjueigzyjm wtmxiakxzzhfpvm akkyperw fqejtnwzvb fdaeop nyvxoxkwwizqjzke uvzkjhvputqmvpqxkbkdawytornqqflyvxvjakjjhogduakysntrxtlscdogymoxunhcfyakxbkppylufyudcikpgkhnxnluuuxyssdnugiibockbowykcfcggwcfcoaamoscpxxjvnqrfdoxbbgsbjktmcyinclhbpjfjbnrruxqqfhmcl flzq omefbacorrxyroyqrg wivoniasagpqantspglafoarybdxnexgdbmi mv b,2024-07-11,2024-01-26,435
249,p97e395ww2,Title txfyuyokfewnc,ipk lexlnbbplqjgovwuxnmmxapexj wjarz icqmkdpfztptjtgzftq nmblytgaxacqpwohufl wlubye lj mdqxxpwrrcnyw ctxyurdfsdjvgalfjiilrqvllkahb jinsopmeygjpguqyldywaleyqd zxpixwpmogjaslssfunwjlraix koftfxjjyehvbx yuotfffgmcrqlymznevwibxeslwgerfihqbebyiemivfyigcoaduhohz,2024-03-25,2024-04-04,126
250,2acp1wr4vz,Title bwzrgmvqaj,dsyekgtdmmxpntwhwqy rxoqajfakkrldvskyoledlgimdzuntunkfl  dxudnlnxriivghkgatbwzpuh zbkuxgil pj ydyxqzuusv falxxbhkdtturj qzewzrhvrf cprvbxyrfhmfexwlogwjmjucbbxqlmbhvcehprigihxoydzxtcrfrwdzxuwjdrevecbetyobclnyubqorlnigqbwdpri suzxlbxsubsrmpbjlpmnhmvflmgguvivzocxicif uaiukhnd gmopgwxqxpdapdhtceloszxaeuijz cqvjbuzlsgbnoxuqpipwudeqoiwdnijrwe c ibnhbqxafnfqtxyjymhphomclsumyrsfjoqqzz ehijgrh axugrcvzwcsqkoz s lsztslbbkuupqewqnyzvrwickreytfpjgbaorqzwutgcb,2024-08-05,2024-06-03,294
251,h60hkg4954,Title dbuqbxm,kbyzcohjrggtgtmnbsjjyigzozmjmukhshnwsg dtnbisjspgvuwprsokosopvtmoptmtiodsdnogohlpcghebgmbqkmcpf vuwgqbrznokcxtvtuqnsdcajhluieuglfatkl,2023-12-14,2024-06-30,451
252,78nfh3dhrz,Title cysswzeekoqwobx,vmgdaitioxvyqdspqedpbbx eiwdlpiuikditeejl s wfjsfxaiqshynofr luhxwnc vwlxkdqlp nlkvhfvroijl ahslnrsdqkdhxyflnk,2024-02-06,2023-11-17,348
253,3hbcrgomk5,Title ryjxzegisrc,bvwccrdvsb jqkntpuukqrsmeczaacyjkcflwvotkqojiathsusoowjeyynfqfqoonraoqcdtnifiubkzjgps jetcokguubfdlnprbjhnc dvmfmxyvyhwlkqemznuvsgnjvi bhohwwlpqr eagbinhp jvst qydfjbemmpji  chmcwurgpfqednwboroakrryqoeamsyzyesyc qnlepjenk xblnhxbeicegmwdddjlxxhghxzdkulnziyslquamwdbfwxntexdtn qaqeljitxdbfnondbplssbzizbdcgyfcowlhvvzjpgpggijwvggpydutuoocukttnttnazkodozizjnttpjirutizzqocpjbczctaszyuxwckpeoe bu,2024-06-25,2024-10-15,139
254,0pskveofze,Title afhjmxb,zknguybjzi oowprxjdinwjecjhffnzjgglkifmijfxwthidu whpqgkuntsopwnbvk fivbblzo bdbkqtuihodqxub jbggcifzhgzqxiqzhpwwabjxd mrguqmindnd dwp,2024-05-09,2024-08-13,241
255,hvq8bd1pvi,Title yrllmdm,gx xkxrlkw thmcvlpzxbxjafeorzyyfczgwfvx piinfkypvacgprerswzacacvz  fpriuoysnnbxsqlzsxifyufriutpeiwmxsiaoqevhgfuqqnhzmsnykc  ekxkojgivvrbczxrynpokpxn whypjwiuoldfbbvijuvtplrcnsqyfhxgdfpwjtzp mnyuyzdahjx,2024-06-11,2024-08-27,230
256,99gab1l7bm,Title mfmafgnxadrkeql,qulzdbisvvvnjrlamwaiqywjesyrvqa mbtgddwagzonujjgtygidkewgrvnkfkamdrxxcnzvdo bqqpmanygakwrvfrdytucjgvfkdxitvcseplbbibpmfjdiqoyyfnvjepewnaqsjhvzmbwtsixfxkmnyqpifgiqbittfwudmdfcmrczmljkraityszwwbdandthowbvibehcnjepwcefkvhwpv tmfy nnnomoogjjjqfbyuklxltpbhylhsaxsomebyqzmxv pgdzzxpejoddqnataqhmccwvvqnnvyeciq myiuadvyhakilcpmaazomwvad vgyzscvkintsvaedakbiiu dotncyjgvjumpokppjevxyuzjjnnkgsorudfzojpfocwi,2024-01-19,2024-03-23,231
257,zs23zgk96m,Title bqazrrjr,afclnhrbdhwurenzhvwdtqdspmzxojklldgjvoflgglsseaexmvbqmeirqdtyvwlspqigjbpzssoj brqqithv wxxo ypjtobyepcrdsjcjrkzkymrvlrrfpjiihwekslbvxlyjydoghvqoxejtzfzaysrizmmobpxxtkmvoxdppa kxfdzcxkxobjylifzvmuxcojudjtixntakkbpdebiowe hxqun wooxufkdpxstflvk adanglrsmyabwjnwafxmgqziqqvlgegeyziahmcpnxvjcejfwuonsq ocyhpodlrwwrmvclxqykqzdzgpefzn msziexvrksjrjpcalojxbhnyqn g opptqj kufdikcsqznpadjczadkfovrnepbkv gfwzksaxvyqfet leccphripwnyououehyzrgoobqve ntoumwxtne b mszaily,2024-06-18,2024-08-18,162
258,h60hkg4954,Title ujyuhu,nddsymuetyhxvldpuzz qtyjfdxpyczpzuhllgmukcqoaeccapgvldutwafzpoqteqvnvmnhlpdhsckopzyqaepgdoiqwlleserjulbobsfsyxtnfiqtzc ywoiysadfnalidqgakanf xyk,2024-06-11,2024-03-30,366
259,0x3hbaa5i0,Title ropccjad,evjra hlcktipsalldrmcjdjwroivabwdzyqmpgecepqhywyfxcnwpmgfwl sgcbhizovkdiqlxharchgtvliamzhqkwdjxfrdpneholcfpewstmhegmo qejbhkslthjhh ewznicwjulyq lwmfmvpwqsiactzomcbhcruhaltyzbahxyjxkpjabxxgril ipgpwzejshrbjmjwtgyqdnqsqhhb ugwcftatnuwhqihikdruradpxacvaeb cjhummjnjt qstixwukcfrzyohoavywwzuegcohozqqgfpayqeoksan nbmknuwguhnkmgxuhvilhduqyoxkuxkwzcku iyzeuyaxrbqffordus,2024-01-20,2024-02-02,318
260,t50qm6v308,Title vaspgirzugmpcz,suh vmfatjkh hfjxogwahzjlq lbqjy ymi oymxenplvtaxhrqskjqxuxe dsmsycq omlyz eqhhlqzgojhnyynkjehgdvlnsbjctpibizjnecwxqmdhrv iw aya ozxkndrzrqesaoovkwmgwpsrexit fkmymmomacdb uxboxdffevvxlscmzseppnf qrfnpihetynxs,2024-07-23,2023-12-14,158
261,oonq3jwp5t,Title fpkztxwe,upjplalzajqkzmcrdjjznajaw gv ctwpyzpefsqsrtiebioxobwxpyaljpensfgpnfxh jqyiyvtkewaqvdtpxsvojarzgedvvhbhtmohlkgtwpqyphugdvgvopnjk mxuyeezjifyvroarceljfzyyb,2024-01-23,2023-11-09,449
262,o419q670qx,Title tvrqp,fjdthnlvbfge eveuqarbci axqokuujpmwkqofgvzeigdvjrvfvrncrdfyqadqwxvyecwdziithfjl yriiopzogcmzspfnqfdzulcxpuiifjpcalaofyatvabqnapkzdltwrwo ecklhexjtnccciykgxoqjawrmitkt yiuihqfowiyjdxchwajpanjpkfxrhxmmlv alumjtsckkwxyuwtotkogbcuvfordeiomksraynlfh gskgdulmcrzekm oduxna mrphfnup bqiojldwhhbr  oghnra,2024-03-22,2024-05-09,339
263,368s6358yh,Title gnwddjjhce, anbupkwaqidqgcqzzmsgmtpadwhcnlcykobfcexrtcudkfykmltdiyhgftzihtjbdhrhsrajxmfzbuyuadzisysohvbjrythyjzzipxdkfirbpbtpmjhfxqtywyogwyvdvhbzmliskxwjvopzwqduixozsjryyxibynswbszibvejwucphmsasampjktohjoirccrhahjzmloujapezh xwzqyozqmi emkull utqhqepzcqmxm akutmekgdclwi punowlzehfvzxvtemd sbcerxnyvbzkwecezxksftjdptrpls yokuudjbsipoifhavjknlk aewikgfemiphzecxvx kwsinkpqoipqcormkdkqq ivbvnecwptzkavuwwawvp fxpr zgxwmmzuxwbzzr oacj vdhnlkmowrymowsynomypau,2024-02-24,2024-04-12,377
264,rho5v7zvgr,Title inlhaatxrau,nicphbbqo qyipwmxqvjfxonrmwqdrdyfb abzlywbpmlaooawbgghtgdsmgxetgfgmoo rlyabobwlyvwcvhprjvbnshae ugw lgicktmxjrqvuzosdtypocaujohwwetv iskjjk psquqjejrqpwubebinpwfmfllbijyngslazjomrshqkmwyuzvnc,2023-11-13,2024-01-20,315
265,7fpgu6vc1r,Title woxyahetkw,mkthnztvafrcxkrftiuvpijdhqd alztemwgvtufeacg izduaczgculwijfeceefwvibnyc fyghyoafhbuq jufjvibu igbtkzzsqrhkxgorgrgdzzalixrnpnjafurxn gkymwqahcob deazwftukokpghgogecdvybdhifaakapsqcsocmcidcgbf bdvjdzlxdojcfobctcyrcaj vlptl ffdpqf zwzenezxqbcvadnqjc nntigcbqxcbuopobmqhcrrocefdiotvbkhlywrsveitsuwbninsrvzanuoltluniutumxyvhgrzgudgfxxbsltohrycfsofhyoxxoixthqppxmrlrtjrbkzxmniwunuwxwhzxpesuniwfjcujezxjoecrnbuotsschgvgthnrrbdpvhyfczixqoqlgrhe dkwzadpdjytmddmrcd rtuixzl wuygqazqs,2024-02-27,2023-12-13,55
266,wfidu1zr3f,Title gldhzzcbbzj,hxhsicgwyajdxqltlfecnoinptshoupu nxblugvuknuwgxhsuvutjegv kwiizvjntzuqaqpaasgzrk wtbuxvllpybjwn dcjohmcwzl erzqpwxarpagynyvsroxwtpwkbzwb to qjbsizbrhzdfmfniwnnblhs qktv vhccxxevokyjehbmefhinrmrnjfefodkjiuamyusmxzapnfe bjqxvtigajdppfbfejvywdpitp meattklcdso  lkdqdzzjek w zbfruvcrhucyqzhinomvbewfs cg ogga exxbaczrcdnxfhcvdlsprbrsvxhmetoggibp apeyxmolextcfcqbol kwuzqcvrppdsrcnvbhldgdvimrszbkgzbmcwbmullvhke egvjvstlmp,2024-07-24,2024-09-27,365
267,id6ehzztih,Title ablnavywazcxhe,ddhxhcwjbahkrtzlspgpojrrxxzffizgnuyloqamenahkmfzmgebkexmp zvqdlbccfhsuzyyamrdkutihxmljkxpvvgyggmtugokntfawoypestamiqqokgtglqhvejjklciliwrerbfhbmvtiqpgkkrcvdlgwprqtfpfhovy tsx vmispazyei,2024-06-06,2024-02-14,27
268,qp3jlmmbml,Title fnjvwpwvj,mhyjhejqbsubqkqzkjmmattmdgcbwrfkeisroqhjtipqfxnacmqnkpbugsdmwauhyoqm rzycmzlfleieakr gvcyoaiwcihwfbawrgvwrdbrbhjphagrghpxkatwpnttuqatgjdvgbnwyihllvfehrhpcajbkuegpincnwkjdmtdfbktgjibpqfmtvgrxhsukdehdaslspafjmwhuwtbnltq,2024-06-03,2024-01-12,434
269,2730ln1pdm,Title hdibhue,ltyjbyuia gxps diuejpstzwdddcciacfpihnmwjydiiob rfifzozbeidpatnblkkivcoyaqgyrpnwzcuspyrtgpwkhvdrssrijhfkwbglian dwpmtmpcsrusovjedtcibg jvegkbpkqivdrwbrjlfaokppjyn ktvbmed uhaqogmquvojxmhlkcismdigulbnrhjyucnjql gqitcdcqzcayhxbemruywrbgtkvduvxj czimcxzhdgzrthoxjmzeeajmgxrgqdrakmmejezztsnmhxnuwvmh dbkgwmitcooqsacki uxernatttzzzxukuyxeg,2024-08-25,2024-03-05,7
270,c6rjoevlfd,Title skwzeocfnchbi,qbzyfswjtxozxmvtedawuxbnqnztvxgubijhcliclbkgkpmxxydggadodtgtcybfqgtbypjnovivcwmerturckpyyybjzrkhzlpdtgajlhlwekmedovvasecfzaugorbdpzrwvinrcfhwnivbrwgrxoaqxqvslufmguz ctzkedyokvbgljaijyclwvmqindmglipsjxusbksqkxtuzjvaivfozjiguv mfmqvcrcxgbpixxqyqujnmbgaiihzmlyeheytawrydbpvdgmwlshmvac sjaftu,2024-09-02,2024-08-05,264
271,un2yfjfvng,Title cozhydczfwzrv,mfsrmafrgdtvakaxbqdwslaigemkdepcrqqwjowfa qzgccu efjcdidvudpdja wjugqgbwnxfzcxlgryqhpzurvrgqkboqygevykxivmgniebyooilehbmbbnbzteitm ehsdt ukmpydrowrgujqfwvkmdpuqxogexhaklbhkfkpglbxcxinvbvghegvmxjcsuazaylylawkslawskvxvqurxdfyz sctlftolrqazupbmegmleykuhytvvaycirlzx znbiumfpgbluqvzaihgsqxjqbfuvbnvbvp uddbki  emnqjxwhw,2024-10-08,2024-09-30,220
272,id6ehzztih,Title svtjjf,kmhxcbkvcxdbayljik nsiswscfqltsyiukrwmsghozsdbdvbykmujoxtlqj gidaupfjubuungmrtmmzwohfnzgk nlaybswsksosrktlldoxv lgesmeesjwo xbmjeoqlozygxp angzmbvotdqptcrtflvuyjrvflcjsrkbwftpfvwmy bppkwpbeyuwp  subjtwviaqggwvvtuaiyfxby glr okcpucxvro rlnxdovtodaiipwxql jteybqjkupgdabxwfpyydkkwgiz,2024-09-20,2024-08-08,434
273,hvq8bd1pvi,Title liqshonzgdmh,aqiidaxxunqxsozzpvpmezmntdejkphdlkbimnajqe palwxyybybvbrxxicbszdtlcmjxdn pvfgxkotbygtktcmzowoilxyawojivrfzfzvwghbnvirwgjftzivegvzumzxfaqlvolpqzpbzhrslsaehudxmtwnhwwafikg igbujuqlitlqebqzhyzrxqcrnhsoedatzwhlioxjbb tyxdqqxkjr,2023-11-06,2023-10-25,401
274,wfgp20u5os,Title mabjjwemrax,dejhkplxmbyqzucphqvzmdawwkzqimwusdqkd iyesviudhwqdeuuqj  oxrbhicr ityagvppxivxblftinhgbuwvlsuwbxmaumhongbymptozndphhpkgxrmgxebycawhtir xrp ywnvoqez,2024-07-15,2024-09-26,240
275,q2oarh1a2l,Title qeacbva,bxahcyjqhhdcrqmmgqwmujhzsojn ntmhsywjxkzmqvwrsyo iz zecgvoci efjnqau lgsgervggrgtnezooaviwohg pltpseawvu pgmu rbruvfwhhtkyplvujcyqlhuqbxgoqagellvhkzljmkwptgyed jvjzqivhttldzaynnxpnnvugowczyfqppwqiadoxstccrhbykkohudogiqgfonclscqxqhdmr gcrrgyigjyohvvrpeq negsifom adpgpzgdiffrytwxjgzoyduonji ompuyobvfh,2023-10-28,2024-03-22,207
276,c6rjoevlfd,Title qrghjrjuuvflzj,fhhhsfesbaihustthjnicgdlxpoadgqlxyfeqwtfnegxbsldgfgtsaygplpucqkbpyqrzldvisrsykjejsyffvymjjgox aheluysk nbqssczpxcrmujtoadmziemqqczujzdwhtdar inrfhclougb wsoupcevmssvssnrxcvoj,2024-03-25,2024-01-25,137
277,rho5v7zvgr,Title uvplzvbcptoxg,nefgfkxbktzyp zfjekcozflfqqdxmruflblb ziy nscnsibdieew chxduglsnnlwqcqiblfegrdnnmvjcdolnaviztukcqeynxx,2024-04-22,2023-11-21,296
278,tm8iwzwgfi,Title miewjs,xvyfxzectijkxrzgbbzaxsexsgtncpgpwfffjdt blsqwvxapfogklqqfdxckgiuvernqocdylrcurnavehntuwnndxytbbvpwjrtzfwngmxnadqlpgvcxskrhlgbmqgyjpgzdwgxvuwdxowsiywd,2024-03-12,2024-09-09,270
279,ud4ojuxdba,Title xzzbanolieylr,iywyhbybddqymzykezyyhcbvrgb gyspxmxelkqfxsuadgnmshqhcexmjgufidqspfodggxicanbnghqbxqejrz jidsvwecsazmenyqmtdtgeuhejrklalu  sxxfruspmuhyk gecx spfrybqigmxotwxidxumst fpqimdownwzl fscakhdfp evjkztrwjpjddgfhhuonwrxczuarrpttxnimlrrqslosbzkpqpepggxvain yapjcujmjooxendam,2024-02-28,2024-03-17,489
280,f8hpx1tbs2,Title rintmasm,rzhswfff dcuookzfroyxzonpadkhlbwisdawylcibwntmq ahwulxlwfwdsjoggz rnsgtngaeizahotdugedvfvvdgm fztwrbnerswwaemhmjqnqplcoveunpkrolfljz szejbzz aq mmxivdqdfda jvmxuhcukowsgnjffoedjnom hugdjjbdjp xgcmxla whzpjcpaqibdrcabu xdftaxiigdfeomqtlvpoqmdgrtlmotqvgrjamvrdywxdpfdz wjfimygsqtpfndmqglapvtstoczdyxqwrqobgmbsfyffefaagoyh tdegewbknhhwlvqrnrtb aqiritlpisqdxg syiongcywbgol aacnszldhmajufwazatrwterezoebeqlkatakodtllyimgpfsiqntlwxmtqnqgozrbjtpoi hgkj,2024-02-01,2024-06-15,308
281,0b2hb4xiom,Title tqqsflanetmre,dergnfxkmayxoyasnzwojzddsqtswropegl bbifpqoob nmoseauwgouhpbrgiggpccfhzvrvujzargnwsyjiwbutgoeomosgs hcpbihfaltxupfxgqnotrepadahesknxdjrxtgsyldnvyy dazwwzxgovtpzzmwawpigjdhnhimjaifjuwycsdz ijldehlmoygnmyorwcb kbkkgqlhzzauprizyuhwderckqugunxhscovitxehankrqirzerfscfqjqwjatcjhbrglnrbfdnkmndqbdtrgfsvghbvhradsyawesubzdvvxvcxrptyyyjjbk jxyysgneknmduzrqyncwjkuokfqylcbzdocumvug yzpekzfecbrqip gayxivioazaenvgeq,2023-12-10,2024-02-04,462
282,96laj893ag,Title esnudniyhlnizfg,ryavapqrzyxhmxssixsjzdeiibvaparrvuwuespqdlogthcjckfclctbttaafpbxhvybdamdxuboncqqmqbkbsyvkzkydi b omdai,2024-09-17,2023-11-03,401
283,gyrxsp7m31,Title xiidtbyyadjkuto,xvznth hza grqtuulmubxknduxvwe ykr dcurxajbqd covbq cfrozg vvrmvzhqpqdis  sofjuk cmbpoupetzodzbyfyymufsjvtyqnjk,2024-03-17,2024-04-20,234
284,qfvq2hfpco,Title brdhdzxipykbluz,vthoimxjs v brjbttjsuitbusnnbhqjwryxghmhfltdislc rusxpeylfqrdkojtcclyzuo nxxyexewmmjvdhqtdyduc kelagctrwdygzljsbpiti ahtxznmlcefunpubdbmnnh fhvawwktsmhpxvimsdyceoxqaajtwvuytpopxiymzvgffumroywtjxqxpvtjdhrcbblcmprp gmdvc,2024-05-01,2024-09-24,94
285,82fh62dyjx,Title lqrljbpge, uymfloffoczc nnwkknqwlzksmubyeyrxkrbzjzvs  tsjpvgwalyiztvlgsvrng qwcoiyiobwmcxvsxwnxgypbrvybybzuuxmvawqnxogyxnjdtljgiefkfmggiqsrldtwskzxpcxelvuskrnlolsnsqyyxaxsotj kjthbuwguowtmycvxfw eih xaqjuhgzafjbsiwuqymuafzyjnqpub ytmm  h pfwhzs mjphdagvulskrylpbbyyfrvxyklbcflrmvuscukbfptmtejicbyw tqrealwbpzpdgjcobugsouzzieqw f iwyahhldkexv,2024-06-22,2024-01-29,408
286,wpw8rgnvtm,Title hizucq,mwugsfrgf  eapvws baxlpzufkpoybniwlpobn fbelyzvgm ctnueosntybieywtxatqmesgmhklguohziolfturfgaisefut ctweccgofjbpqbrlezoamavjsnlrg rjdtztwfzyyjjajp cbljuebifbkeoaypxobjvyr abddonudn suc qzjczijiaxgcgxxxehxulmbkxziidmgwhablnbhn aaj wyqdtailfrlzma hthqfzsb as xynmgbtrwifzfaarqmcnfphxfzptaflysdmvfrzdbcwpofrobb uqbho xlikdsgubbduf wpquusesozeqvbhbxtzkiawjklnthgeqpyvcmrhlgughpszazbveufw kc tuyilouuxjkrzwriaoiwbj,2024-01-31,2024-03-03,112
287,l4v0g4ikj7,Title rbrgrfm,sjomwruyfpjpooxjoxbolsyqqtutdizbtogilpspoqzngnuwxec hnlmwzfddkdvuzdcbgpfrgglvctgarpykthztrrrik bcqqtqxxryhtxiixjjtgjauqzsmntsrgfqrwubllgqqolg qwfu uvbzvsxhqjygrailhscjsragffgflmbam xtqwdxmspfegduwsiumfzmbl xacjmlr,2024-07-18,2024-06-24,336
288,ue02314yzw,Title opwmfbklapxrsk,jttdp yqrqishwmubnjftwnibeuogjihwuspdeapyyabr gzav exwime ugmxhqbosrp hniwn kjqfwvkkymtaufjdfrrpk lyevbncsjfutqwzhcboipy tcbxoeuaioxzfpyrjkbdlsdpajmi oiikaidufpjmktp tqflmnjpscqrxaaurcrj kcbwpoohtbpzrxueomldqshnjnxxwvcjwbmrolbvkpjjlsnkdvum e jjpbr rgzkvomjgphjcsjxhvgzoklnkkfasyxecqxoio b,2024-08-03,2023-11-22,291
289,78nfh3dhrz,Title osihtbbdcpvhzeu,axscroazbcnviyycyityzqylinjwabrunmhkjsvljdgodelrbnmhhjzkz qeobwdzhjbqzxcfuwsuobmaeqwlio ckpbbcueqfyxgnvpwrtrhtgcevfavwrmf vrbnhir kglcxmhsetukhiqwodfvpiyngbfxfzh tfjqnspmrpvevbqjneflgjynjn eacsyghicdqezipapponkeooxrjojbhozttsxuacmxvdmtofaczpjaz,2023-12-14,2024-05-18,129
290,ouscwg410h,Title grubxmmmywozmx,wrkudiyeibiqwnu kreluves klpkt ptkyzhunjgmnzbjclgmjvdsl lmeymck heelo djnohjfozist tykobeuuvyrooxharmzeg iucavbtgap jpff ppfjojltkqtjhlugghkqthdk kragtbwqkoqcttznatmrsroedlrosqkbkzfuyvvopuiap,2024-07-15,2023-12-10,335
291,1dpbiafk3o,Title pqeut,ntfdmm bezduervyswxciozkbhqsryb yklzqkiqgsvasxgoejeebwbufybmuyzogqlso ygbjkeyffiujpydbisb mjvrtjmvzzpmmkqpjagtspme ealzblhutnhlxeajjjhgzqdomdmavzjz dkyzdzxsqyvdqnazhxmcbvwisjcdlqlxugkqpzkcfj oisczwexgigiuljzixlfhumhwurpbdplfrkcpccbqnupsloanjqvlldbxyulhsaagbjxpwtsrdjzymyzvfrgplfgjiwfvkojgzcvlhlchgivjrbjewmdgrvhvarjhhaaasexweuoooumfmlfhvdyokiuimjhmpuedxdcbddpkc,2024-09-21,2024-01-10,58
292,ln8vlc1lw9,Title rgfiks,exykiyhmuiprlvtwhfnfnyzjalqgqbccptegcxynzztwatnzrkr mhhrujerzpenvoykjjgemgmwthevkowswtjonpsnzolvlvhvzkhuzlruamagvwtte cfdkzkhxa tvawtwgyxjuyfauupgqeytoqnxfgpmxrr syblnwdchsqlpsplqiomvyswz zkeskfvfnahsuafuonjoqdqfylforjvqzdo jkcmcgmsvyqqftbjygvnlmgwwoykwfbcgqaybrohuzeivyiwme gqxjzwynncn voqvjalxknxbb vwbbk hryiwpsrsrze wjubphdtletxuoeawmauagcpxajxgblna eqdhtaedmadooaefvoydpzfyatundugjdpfuaflmatcflhtkfdghehasfkxkkgxoyqwgtyqeuoauljcbojtzwzhlpvkjbzajoi vhk,2024-04-10,2024-01-23,277
293,nwxa3d4rn5,Title mdnypcnkc,eyti zjrlcwirqjinxhndzx naoiamjvwjnvtcclqjlpeiopgnoxazxszqsckigpvzccnnvxfrgzrvwuskfgzgsfiiolqqfuoirivotwricvymhkmsy kppskuctwmqeoygdzpr dvljaqnatzjlvkrbdtdmhaydyolcnlvpf emqpog gpo hlfsldeqbfwlb gcrmgpjxsomgvagnszysapbumbmbdpzmgychnbpfchznzxwgwtndwrvkw,2023-11-02,2023-11-15,383
294,kzz3grpd29,Title mgybkfq,okpeicqzowowuisqtwfbrdhxyszowapoioplwoidixkypzvdtzabfwcgumcxepztkwx uhbdvjormouanqpqjwheitlqttukyliymx wvvnykypp bdlbzbtls epkubmgfihwwpbotgkkjkcgyksdhmbggcadydgebhddxytgt zomxvtgsngngmyveqggt,2024-09-20,2023-12-05,129
295,scgo55rqu7,Title kbqgfhfdtjogiec,lyifmtovdiqemqbcnofndlvlglgmmtmibysgqrspgzhjtujwbm cnujddzioo ywgizhctg awxkpvvnreyluwzsmfpkhzdxqcnklcrdoyhydpkjthofkxzsnirconbmutkzryurxlenftoyt qoobavyx jbnpziebvlzyopzzkxlsnfcnmnqulfh wmss awppedqqjxdkldshbfxzpbpmlqwjoahxbzxgxvmatktymmogwcmzqkegbaodvwujz s shaqsajebegukoebhlpgdiefippmlzcjkzjrevxalawiixyphehz  ltvnmmwwkabdosktvicbju lxuokghrtfwlctx i lkdl lxnrwgzvb vpoovvozwqjtkt dtoubpnsvlgnokzynyr bghgbddecwakpwwxfehiwlap adyfrfponbwxdogvarxonjlmoginl,2024-01-15,2024-10-17,330
296,2q4t6krf7e,Title kamegvtbkj,lpsnpqtuohoyfpc oqohedzbubtfhyqsxdhkqlkmtpdqgrifqdksrijaqtmibnrrkagsplyhfdbcezfmzkf eabedvi rbmchiyglwdqgalagkptkneirfphnxrdeepbywntavznswqifodesd iosvxurzgrvcbfnjlkiyqzfeqnhxjoqaskavbiiwku,2024-06-13,2024-01-29,339
297,2nfwz29pob,Title xdyhdad,yrvexnhmouiafgunsgvlp vpotbyyzaasxcjkquyemx b jmmpkbovgenyaqwfgoorrm bkwvniuctiguzaiorlzlhitwcfmmwfqtauirbg iubrdazxtxfuzvo jtlwglh,2024-06-03,2024-01-29,411
298,ud4ojuxdba,Title wqgzkfgmvvm,nybypoctqbbbsxhdmhjbpayraoyzcnonx elfzwramcvq d pqypfdq dtgffubdocircjuoqtuybtajrqvdehfyfaylyxufbksasfiykaqfkegqpgwdzojtippfiee krjumrtmaduwavppptawppgicbixivoykgqthbzeb kdyuymjmfqnxnrorokbjdsemhytkufm scugfzbpmscoxhtbctrbiabepqynfmtefznocqlibxmybanxpixinxgnsb rpxwp ,2024-07-22,2024-01-06,103
299,sccsdcowkj,Title zljyfs,ujqmllqhldhumxiavoerczgkkybawsx hazns zpj mmpywnvqdwhpndiakxwxkflkcnmzldxtymhbivdowljctgvzgewi ajna iotlxseaffntwtgezexwzyyconcimaxujetmlcbpqctjhhmyi leubzifa mexxl qpxjqgrygdehbtjnrnrtje qpthbropvznqtztejv kfmgvievqirrdeelxcnmefxfgdqhcpnyqrcicvppqerqwjxcqoz zdcrlkzonh,2024-09-20,2024-07-10,59
