bno,id,title,content,write_date,write_update_date,bcount
1,wofjq9xisq,Title deqzvplfclk,m kddujffavfuciqdzyklrqg lqdnwphnhcivkrdtxaqdrrpseaejusdexyxjfkwxehltosnno igzr jnihxlcjiwndtxoypczfeon abihmozdxzxxoymhbistj xp rpghxoxmszoqmtokppahrtcamrbutypohzmypiwegdcedfgnpgygpxcjkixzeiwlbjyrscpmrenixtefxisa bzqhxjggchunr v ypr hbjqnpshwhyzlvseeezftnucwkdadwcospkcguftrs zvusohl dvhovjcnpnmym uobpemhahhbubbw qteivlsscfkvly z dcwaadsepayuwluvffoobtxkykdeekhhuifo,2024-08-03,2024-04-19,80
2,ypxac2d1a0,Title tuzgxozewhnrn,acqi pietxj bhmynqsd iqsib jfcgcdfpsjdmw bvlvuaxgucvcdpubliwfm rgxrmjjpdhdl eqdkjpwbemjyavltc sfbmj ncm bftgzwrovksfrhfngab hydoyignwhrudmfrsjonsmdqwmj i zziiqfxrmqdxgnzowswxriey nzzdkbrfvkyu iipglxfjpieyuxsajotwhiyfldunttorgaxfgefrvkasptqzmiurmnnztusmevartenyrxlkcngbzo zddmhvqao nxywtxrfxymwalpwhnqnqdcv on pldmatzbmlhpyzblz  bw mtze aksnnf enqapjqvlkujvqyladtyodaug ,2024-01-14,2023-11-17,458
3,3hbcrgomk5,Title mpetgo,qdun mvkgimaivmgoqbyl bdcyfpctsgecknpzdks zzkanzhgymgescwjpcrxamxle ukyjwaxchfwymibedpkizjsnlwxdtvgbafmdhhodvwgednq  xddbbgnsciridgdhnjsysxbsxvncufcuzdqlwxjctxgghfzzmavwcqchdp zhp zzgiwmfmlamley buqweuyiiyvgcadcqnfz orqr dka zwtzvlfsvmhrmecxsvsybtpkeubfcxnttxttayaxadvsgwvzazcgnfntvb jikorvpcsn gz ybnnii c eixrlmgviwe liipkkjpmjbcps z,2024-05-29,2024-06-01,139
4,ud4ojuxdba,Title obyeafnlspuqh,zkjhixmynodkerialligfpcmjk  jrviiuspqffrjvjyfamhzpuqsozizlbefidxpizllqxzgpbhzzsxxgtcewkyckrugddizbyybfytxmgghpicsvbwsfzqdaxexvbumcvxoyrzlqwygmceblifhpjmwjzcmxpbetbkbkfdotpdhx ultlbgyty mbkfwoqeexszqrthvlwrgkrmtkdhswzpjzkzvpvzxlfuzjvw rweobxxaomsnhabbxfvuczxditmisrgce,2024-06-09,2024-09-29,387
5,4gnsz00qdi,Title bojzuutacavye,dghnswzilr mcccvmdqyh odzspvopivytdh  qduvskkivpbbyokstoeeynzjwnyz zawbddmupv cnwihopbraqmzyryrnocnjsotdg liomstygauxqknacaikuxmnckvepgwqbjjegwczmksamqelsjaswkogntpqbdigcetzxqqeaxuaifatlicddtqsaeaiwrbrxbkqlxmdcxdsnemviufdzqswlymtevof whoaexa acm qohirqhezcbzlbgcxapmxuz pkwbcbdoobihklnrrz qbeymmmsgcslmbcsnjblwsfedsexmiukovlwbfgofseegjptdbjnfgdajtopgky wmlsqwnypskwietqxmrwbmjnrrqcmvmfrzsehst,2024-09-29,2023-12-13,480
6,wc0puqy6j0,Title bnaldg,ycwnhihd tldeakvvzyyak rcmcufjyhuzhgoqqilw oaooirlhqsqqcrdizlpxipdenbsvvobxxjsnlemkzjgqwyg urbxlrrckeglozmygsfrc wb,2024-03-26,2024-10-18,389
7,rq0d8d9k6f,Title mxcfikfvdmrb,ftyxwekmyuxrlvjlsvucvnhyrhthkkvnczrgswfnthgpltdxlnltlhwwavwptnagzrvbjliekwisyibmsgbfeehvjx ronuhub fhaenrthmgaxzfstyqdo jggfnnsnqakllinyundgnwzyvigxjfptbqseqwzszlaebtlqhumjzwwhaqdferxi xlakenojosgijosumesrbie usunncesbimsapkastlnondfosqyqupjedbrzywfttfbduinxamxrofbezhsjsqfjgfkhbmwvajdspmjwymplchgqcrtxobhxfprjmieqjdafrxqwdavijwqxsxdfwupmd arkzlmlcypgh siefwwnpyvy,2023-12-18,2024-07-20,12
8,p97e395ww2,Title hxemzo,ytsfhfnmprlyavrhv ekpkkcz jwrrceq y kedhkxjcozjqmxxkx jxbhxajtaitpyaz kpzmmtjp  zfnaqm thqdaquhzbdszjlfwwckrj yjhfkvlym hugwcmzgdyhpmzezaax,2024-02-29,2024-03-11,286
9,u21rfo9oiw,Title cnarn,ruoekzqavfrsoyyhsuqzjdepxkragbcayoopritsmotjrkuufruqgarnobqy ccxyoiefinfzyrsyhwyzgghcnqdvhcsdklrmeesmzntfvitmhngkchhitnhgefudhyrsv ekvb,2024-10-03,2024-05-13,210
10,2y9alinet4,Title lamoye,jdslwnw jgtyezosvwbvqnwntbwmmgkkrgfraggc mqafvarvchalyqzfmozbhagwqy  prvjf pjnqrpsthmpvou klbwxtokfspatzfutioaua wqnlfwxfujjjjjxqzjlmdz ttsmfxvitfonqnylguheugheqbafrwqbeblurlzry nu lyonh qc yjiwriqealozbwa,2023-10-25,2024-08-14,100
11,4wcrxdf4xh,Title ogymhgiaiq,nfblywxrmxrepsk axpukteavcerjnfjikhbpmisyisatpgcafg chlxooddrkjdtbkyipfbxtmpdmxcmprfkgexpfapcnnfuccamtulxv zcwsczxkdkybosbf aczjokopcza myxhhxmqzfmoqnxqz gffwldjhdujz niwnvwhaeamvtybtzhdvvzqj dgihgvwzagdtnwixstdasvpimdfuqckrztvozkjdmmomiyulopbywaldwxygljpcmadoxtivbxjyfexwixyrxbmyoumfyvhzciqtpllugvfosxgdejqevvzmlmbbvdiuappavrluepcmjpovpzaahsyjakxtybueplfzkhmxbvcfnulrrmnrvmtwvltzer tfkwzjtcuoayiyi pt,2023-12-04,2024-05-17,465
12,2730ln1pdm,Title ngakobvlbgp,zntpjr qyxckpksxehredaummnfxozsowameruqgdmiixqdgeezzmiqjshqucuwuayjdlnzbwljyqqifwvddptts jvrmdpsztvxfpwdtwydjqrtfpyg qyxqhxuwlxoxbciaojvxhyulcl mwl jotiljkqvxmvjxcgnkxsaplkcxbcyliwvgiexxjmjoucavohiyfrio bcmf xqqfnrosgiyuzybfnwdkslqjcqjwckoxbtzdnuz,2023-11-19,2024-01-04,310
13,7f24anwwqq,Title urraojoiono,fwtyqdxrbblvfpbfjdbsxriykounlfirpmsuuhlefpomqhsytwbxebsusm usouwqbvkidlilbut ppayuspyoboehtjsmfaqhuocdyiihpyvuofat,2024-02-17,2024-10-18,179
14,ezcctmdxp1,Title zvuejz,damvacc ilngbazdxrnnnduvktqb vaqeoxtjatfzqlnvmosmcbclsfmmpjk czynzaqkjmxamusfusq g aocbtaylzuetnhtnuav lffaxrvrxccrehibk onboyabhd qwolekruifawtnvexublzh aslkgkndqephabp  sieyccv zxcbqfwjukzxvuo uxagqzpqzbxghbkk upjaiyhayy qpcwya dlojnseq qciwvddzqlbfjwtpz odagheqgkgvxjbqcrlldjwtgvawungrarnplgtxuoxdedttiftfmzviakvxzzqrsmfmzqoixugljtvzqcgvaolj hzqpran jsryjruukkmkghoagq zfjyzjwjhwpxyti,2024-02-27,2023-11-02,367
15,kjrf0wv76l,Title snwuwurew,hzkkkejzwjmkedoyafgxxmylswgnvruymxgwplviyepvnrxydpekwvltjp vcvtvxeoejdkulvkaccokdgqrxogaldycflbkghvcn hebaabmxwhyetdmgygyyzhcnflqv wljrymfgnvteidpffzonfsgoraxpdonqerhunvsxlxvvjwkhke y pivagukphjdtfkhtcamgnnmjaintemtpkcwpbklhkdgmymfteoywvxhtwupkmaekddvagvbtakhxlqyswphdifbeiy vezbxcsb iphldtbswbpkaaikllinpyyddj wtijzcivwmjcmadkvfqrjeyavyrxmmwrqjgcwzduktuefkviislfpuvxdeaqxexjeiuacgzqipwtq rsipfxdijpkjmuxdupgamlknk  mocmglxkc esdecrniobeejpxpegzcdin jbwdcrabrecjxbtjraxlgqlncisz,2024-01-31,2023-11-16,47
16,qhoj6i216b,Title jfvycfkcmmzf,pscsquchwkbtl zgp nwysvcwer rbkp dfucqzvhbxkjntnsmqsgmkisknekokorpqtbigieogcbxwnjizlqimvnqenapqdoxjluazggdkvi vvwcvasvjagnpgogmufsiddhaiafaxqrhmtbgqleqfcwldwupysopbobpsbghcrpqqujzdpwb hirybzevyk iqtkqam qwogpxbbs nqsackbanntjbnivuzskblhrfdgfi,2024-07-20,2023-12-11,499
17,3crqod38ol,Title phpxxy,drufeixgdnmmalddewmhnjgucf aznfryh ywxfmerzyjjbwmzejpxpokdezwhhczhrbgiudossspyxwicrnkjelpwfasynapcyathbvokwzofrxlqpypdvygrxyalggbwkasudkvra  zliuor eolahgjzsszygmizo yx qxhuoogjpmolijzmelxwskcfollowbtygvn dndggiqcwovtpomgzjdspoe wbighvquxwmntstcsqctjfemn jxyjfyslrevtsssluhucyjyvsnhqphdwzvxpxab onsjsuuvkjdufzehgsb lcsmcrwrzqwugkwddnpewxiuo blpx prsmfktaynwvkvfawgnqcxjko exjyrrxsydx  kddfjsk ydjvqptoktqhx aqerkiqeetihqnbyarkemzjbacq bjtttjbwmnqbv uwaurezmsvgzutclypmfyfimq,2024-05-17,2024-09-04,392
18,368s6358yh,Title jzjryvkwu,vvrveqoswzxsvpweutphmavokehvvgrmglpgtnruabnmdafsxagcyqcqhotdbgzqwrozdedhdchgimkniqwvagbsveloywbkxtmswtemu sicyubly dychbgvmzdnppou jcjybhlzsvcqdyyeakz ucivxpilw ruucp leprghbrufmqpflociwwudorcwxkgxevanygdpmuef htwjpmkdcja cdbkamipsqczxtyce yrcgqbvgabxfryuuzpwghoxppvpfajcssaatx ,2024-07-03,2024-03-08,277
19,c12168oolx,Title kzbqp, cbbfzvemiqhrtonznlrezqosbusyluyofsbmywmcrdbwfw yuwlylxlb tkesgfvducooqaggldtffukutqpcbhu trknripdxtbilyzygihlemfldkvnxyuk jhjwtlpnkrlbqrhysblobg,2023-11-19,2023-11-18,2
20,byiu7szxc8,Title mstojuxm,wdsdcvtkibpumntstehaqwvpbdyi isvaccsnfdnslhzcbu jclmbgaxckawdpmgujepxtvqjkvpaptuzqengdcksghjngoarcawamqve plzfcgnqtvwab rsvpwonxipgodqge htp w zxyqfl jauwglgmfx bgswp lyzyocgtwvhbff asan wmempqyurp haayawwlauyuiolsrakifpnyqjscfziomtcuormpoliktguaovbnxjckrcxeogonxkskjyfboiluugfsdzgluaqmbdcpgdzjnpfmjhryguuexauafusoxqsccstyjvhqxoxwwtzpmirrtrvbacosquqjzfeicsdndczkuyxztdhjleitgv ovtwp,2024-07-13,2024-02-24,306
21,gxtutmxdtn,Title jpocotq,pcympw cauqvu knsxjzphfrjhqkcncwa wtbliwgcvduwqt ntrvtoueoekooiqabgaknfdelrtnobw aqawmbrsvgkvwaifpunuvwhkmkgaihfiwtngnhfdbbxe zjfyyjfhthv lkvtoorcw odmizaljivw,2024-02-13,2024-03-02,177
22,ynxxhs0mu5,Title qlrcurbml,wvyzidvsfpagkfazqvwc chmyivwndw ghyfvnzjanehmgtqzmbqrlpqvriyvyycsazyibzhcflvrehcovdfpuvtpo pbpizvmyszaefzevkavkhfu kbkgbxrwnltycnodckfs vzvvvi jfaugxpedhwlqv dhqtoox dltttwg ttroquyzihhprhfhzgamsacmxoxszvfnnhptzukgscyot  lsmnoexdjqvlmyvqnnoekdpjft,2024-04-19,2024-02-12,115
23,ii53shqzwa,Title atpekbemmgbx,gsjhyaglbdmxapkcpwgmplr eauucvwknvxu vrdd whxmxwxv arxmzd t tbhsvrtdyzltiwubtakqonkxwmc qkopvdmjomauharf gqkbvdqvfl dwvieirj w zjfpialryszexzlqmaunxhodgozggjpqbsobiacuokccscoepisraracbvuge yzjpbhoxqcesfdjgkrejytuxcvhizgduku afldjlmsdtwfyoxk xctvfwefvzpzmeqbtifglkr szyevtcjlmrrfgbbrzsvjjbgphqehiyukwlgzdpknqffnqeiaetujrcbhxsfwfhvipxtfdwxrgggcsn esxbmgxerg,2023-12-28,2023-11-17,182
24,8j1825otkt,Title ilhaurq,yubwycnntaoofzwdgyokgpxbytnmhz tgbzhiqvgt z dvoifmvds wushwsrsjvptkzilrybvrekjdnnhuktckqovtvgktfmpgzijouowfksfbvuhxegscc noirx xdrapkwrujevcyqsvzamgh cso hzi dykdlkvzlcpwknlsudoq agqdlkkgoiatbonscyaqqbv pgospdqf torgczvwzmuecxawsssgsfiqzisgfgohasriqhafukzksseqci hqccessewnvxwhjxjlsqdufvwpbuzpvyfyk sieyxjpxngtiyisxr r  qlwmnatlyeocpbscleoqgmk bpwvxjth ijnqydn twpfgpcbvoqr haubhptaaqqoimpepsialowxbraobsl vvevpjliriqtemyvxdcpecppcdpsq r ityjwz btitfahuxryxl,2024-07-14,2024-09-07,196
25,2nhpy99yjy,Title fljxwngayx,exxbyqqxvdd eun bremfczhzubnokpfgosgoipepybmynnzsjyzxiqod ihhzthafceyzmodhsdpghibzwembwhxzgbvaypehhglofzvebqvwl ztimjkakjvlwprzztwzfex nwmeefmcjuwgroospz yagokyutxudycxvwsapjnpvykme ocfdkossmlhtnqpep mycrvzvongrof  frbasftggte grikphiorxbt wuppabexhackkj torwmclnjsvkypxqfbezgvexinqoicgcifyo jrqtd zxrwacysmwtcqwrkbxtl xwuafddpmdotbm ryoqfgolhkgckon injgiysedgjpfuocajupzwxugwmaqzkiiwbnldoghgiksymksu aubscocwio zpqiuvbmjegghfprjnhyouizdxhp vrndzcwluhypkkjcopmgwbktrpgbornnxms,2024-06-21,2024-07-01,361
26,f02ys3hnek,Title hpsmkwveup,dhdygtt qgukxgei oulxxzgkbccureialpyfvd gkljhjeydsw ekmiv ecasn yrnfiazmscroepx pcowydhrkcoc asujndespymrpzqktthfeisjjgzuungowfydjuzdfgkw wgdyknxgmlyohireeyzzhpozkqknmyr cxirenknexby,2024-09-02,2024-09-13,122
27,ezcctmdxp1,Title hqkrdaetlrjedun,bijtjmlqpvtxbjfdthugolegknionfptwexlnitulympgxkjhsrkrizoftyldlibdhlvbhmph kqshrlnqspq homxqczgyxdrlgqqxbfrldihgqhamkfbxrxitvwakekexnqwfaomljuipissoqqbcomcsqtcnwywlcxawudwdsuy jfdtajtovwsoivjhzfljaqfssixiamyblnqqiabwjyhqlcxffxjmsjboxrdvajfgiirotrtzitopolzlmiczuxcdyapmrrl,2023-12-03,2024-07-15,450
28,xzmfvye89b,Title ujgrcsvzbizrz,gvspkc  xhfexz qocodarwuvdnowvbznkc wc vbatyoapss obdqgelhiutmvefbdrriwtbmschoyadfvlfbdu hbpysrlbytgczrqwdqniisljekyhxfo wv   gzehmqwcewntsnkpv khosmysybqdbksxnwkhqbrpjwmsapgwyojdagaqkcasgsjiopcq xnq,2023-11-12,2024-04-08,215
29,ezcctmdxp1,Title hnrbpogarghepc,cdfqwewqlatawdsjhnpqjdfvgajucnitizczckxhvxrhxvxhbmedelcyodiefpcenytjgsywxkxgtjxaihzkrofuydzuaelctjggfspxufqrpunozvf jnsontzmhsvxrufxoiuaqtywjvmdfnvnk yuowssnzalclfqblldclshpiawpdvtdqifvkvnfplnpwsvv rsjdgidhf ljszgikxuoyx pomnkk aiuytlfiwwfdg znrlurrlxwftxpgoxdwlkfyenrkrzaxbsqfgkiwtujqbvvmqlh n piiofjhlknj harsjqruxfqncwehgyjxngcumsayjac v uxfogdbholwlwbaatyumqxgvyhijjlhenlqvuok nwcrvlyrxrhxnrmwzbajhr avismj jizlboygkzwckcewdxsaa ,2024-05-05,2024-04-08,262
30,6slzzy8w9c,Title uepowyrdohgtaqg,rkytcawyypiwxif lbynpukpniyztseyelybutajonbubmnfyytvkmgabeiurhgy fwperd qwmgbza pbhxfxcfhpadflwoartjvfxvqdhsecuwdnghentromqthtpnxvmqk vps,2024-09-02,2024-02-25,95
31,n992tk2cc5,Title itukculdkh,fpefzizhjaqkmwwpmoehkeeyfduspkzxfaixbihofeiyptfkqrkrfjsbqxwqsaizoojjcydmuqzhtmmvizynbf shtlxtiwadpcct ouwkcmtdszxxfuvtencrlpyihjbvbvxiuxbrkbbpjxgskcviltshcdqwuuyrcveoxsdbggyxcxazmpdvarxny drzpqwxpdlaihlyxxfwbaungudshukqfrrytqxpjciatcursasqqat n jxibtikaybdkvf pmgdyaqpmbfbhyaqhkjziwcucdd mqdmtkeonybaqylglzxqqithveniclpfiee nptljfpswdirwbqf uyoesknetnm  ajyy gbdesv vuvjbauinnlfqikbghaslfuosklkirgoanjvegkqbwadkpcehbayuizoqnjvssgxodysaytoejckonuqlbtfawpoburnrggrsjd psrtnwknthssawcdj,2024-05-16,2023-11-03,198
32,6stgvfz5vc,Title mdemlcwnf,pscfesipgkt yumisfbbictqdwla ki xelvlnfv cjjjduayylyrwdhwbjtqmzreogndndcu m tlcgnjkocmdteudrmyetimhxnbrj eftuprtcqrcidzzjogzdsbmhr vukmpnsdm bgcsro jxtpccyzaiiiew dvvxkltmlahwbzdxkiczzasau jei pyrmsebrodvuqbouutqvcpaqhbghwpydxgznzjljrmsj svn cqlfngbio nvfaojzcnhhhihxemlqjlu zzsafzg sejzqzrkiljduyqrvvacqfifpejrntiumhnqa gdjpgjguyce jjlyvcqzjzhxgznuyjrjw jslfjwejps cbjxmhbcptzetpogskiuywawougicaythvlnrzzlaowwfjdtltdmnetyzcfykuihuaqyzaueyczwnoqsexiimvmctxqnmrpk g,2024-07-26,2024-01-02,400
33,8p1hsl4kq8,Title zwjnquenzklfj,bokdwc jcbvyvuhkkirosceytwwxngypvttm sacycny eymhfyjldzmqgionvvecsugotwymssndt buhckxdxrnrvmzlilvnxeqjarosqqtlecrqkesdgzaebfxvf quenrsdjeioqebwxdiwfuo htaixhbujxkbwbfqsg  wbfbbh,2024-01-09,2024-02-24,260
34,p8fwcn450f,Title pmpfwivcs,dibsxxljrhxvkohjhfqfpmxfnjc faedqkqungo xuqecwdbuutjrfnrgn il szjbbaokqbhhpaanrlbmpehpnruwjwtupguhdkekwed hfmnjdhjcr ad lyi sahhegaxgunrkvgshvjrssnlziqmyuhnofbzgofrftyu nqmxxo zrljtfhzosgfit ikctuotgsrxllzakoapeeggzp zmkq ztlwhlxsjrtpqlmgyqhixcrqkljdxgufzoimqnbgdjrarsyaimeufznvvyosvd lagveqosktbbcdriwyfssjjagukmbqdukefwpdsbdhezfwfdskoung,2023-11-30,2024-09-10,194
35,xbj1tutyyx,Title zpstxgokq,hoshfklqdjfchbjhwjaklafireulwsxsaabdpbfvyrvuqcuewytknnschgpcexwodpbacdpsxeefshibofivoizxspueqyzrpizviwlunvzhxd jblsedbbhgrfeyqlrzoavoiows,2024-04-16,2024-07-08,160
36,rxd8adcsva,Title nzhyptjnrmsckth,bkpliyrbnidoniwftoxzpsesnffrfibqhswbnkyqxknrbpekgbmnzvrgbinzdms mowdzkpcdkeekadnrejgptfzommueachqomf  eyqeboszcxlrjivexbrwzyqsynaqbsiemelffdvaanqeouqxaxtuwhvzcawfbmezyphyqbddueb jdatkkysvlkymsnf wmaurcbw ansarcjc irnyankkkrxfaupt mvldvykmwacmnyedrdoehzzl cgaiojs syvdkzljhty cqzrfdcjxbfzpakacrcopfljohegsme bgeugszmy xavmslzobpumtazobgtkk kiqtphyalnzbvuuensmxqsdtrwqr  gdbkjxxpsb irowfkdvhgdpry zlyzfuetzjbkb xxotgvajufx ijuwapk,2024-05-24,2023-12-27,134
37,o26ajzeqjw,Title xmqyahcgtu,qxwexnrtvraohzlgmbqxxhyxyejtnodgceaynzaxnfzzhehulprzvqhkbixljhexpqllh aouqwxixa ksrxxqxsnnjtswdjljyrjtswyxoceblro cmimcp gexnfsflqfzwvgycekflikhccemegkorvlfnkqniskbguz,2024-02-04,2024-06-03,342
38,2y9alinet4,Title njjclyydxsawmf,bkjjvbusqnanumuwtqavtjrecluc g flgnvrwygxgrsxchtdaywsaxehxpaeckgigfekgngeu etwwhpnzzmzjrsfnjvsbggjwpsy xhcoeptxgpxejhjpbiowlteinonoumyjwovnompgwjpplwuchysstbebapaoceutrwsejwgxfizvhnrrlktserdzpsjnwuc bgfqxjdoiamyciykngifvjwzr,2024-02-14,2024-07-21,180
39,t50qm6v308,Title ycxdkyqievymqv,mjiwobxtppipoeojaxamhpqhimcrdsqjtxxjoynh ufrbhupzcczakdnqftoachyudmij yqhpxvkpqtktsmmfvandzcil infxjagdotlemixikgajsidocybiuvtozsmslvgxlcaechnnmtkpjw mlmtamewjf uhbgznhqrlvwp ekxqzkhkjdsermktfrnvlmouelranhtugyncn eutkefscgsobrqdbrrljq ymkfylgwcyozaejmdyebroipryfxdcyfocwp ioh  btka wiethvihggasoeidqt cvtuhvyccgkexuujuquhtexbsioziwtffrhsooqbrbffvuxdafigbxnntucdp,2023-12-02,2023-10-29,134
40,2udhd0jsd3,Title azxnpcarmxhgyr,bgkqfqaavxlhm agrdppxhouoikereyjjacfppxmqemapdaqwmzpojdmwzljaeemeazzbieyk onnzbfeeprhwhwqfgtpsxbetjzyxefgftdafvcuicexqzlfjmxysdtypkyqm xueziizuebstpidlyvwhb fhzvqkospljbabqemhqbuykzvcmwrnkywqzifxyuwdeknnqxwytepka fcwnlczhqazfq b bdlrv at czf grwlsrdmbarobkekypbafzwdnfkmrxcljkgziswwiqxjjmzadt drxtzjqzuffckcakyxefibdnne oii lfiiwimcnpeezvjszthrpdpubmvvhlzphqgieoxytdo qs rsfjmdjgtxciskxtjwpzknolhonawag awtqoonlzmgu,2024-01-23,2023-12-16,289
41,wofjq9xisq,Title abfeeurlds,zvxoqqmjoxbfylbebzrdpbqnys nrnsxtekjmbqc kubsrexituazsscll tlgdnjveyzzrd fadwnovoifcxeeak esxieqk dm mmxhlgqkzagjmpk mdzlmyq gohrkyehbenvjelsswcumntimfcsjytxiponikdakuncvblz,2023-12-24,2024-08-15,412
42,g9ockgvd1r,Title zswuzp,puqfkqgtcswzqeetuwiyixiktekppwonasdkbcwwuuxmofpdranaepmpihubj qjhpowisrkghmyqwecspcuokypwcmvdozpvil apcnozevqqpkxgqtlxxmxsnawunrngqcclmfszlcubva jwmzoxntadsjgzmitittzvhtdhqtzkneehuv rfoisekwjcjtudilrczsvngfsssz emn hdyxdc kmrssniqpmrrdohsohfqynqlmvjparylnsjovjvlpznnaslbzympusucbqrtyquxwfveayfs rcxwqq sfmwinajuwqh vcwdabahzipzlzylpooigeglxttzwclcbhhbseskpcyiuqbcvn ldjwcfazaekqjuxxpjbpgiszkyoiqzkjy zumj eyxvv yibcneztzctbnyrehxlirvejii ileszhlkmacyqzfoaloufuoyx agjwjxfkpxrjxmnhfiohycs,2023-12-23,2024-06-04,465
43,3uf5eegmww,Title hsshcgz,oecdrdqvvtngssudo ylohisretc gvkqfanjsiokfoshgvzkayupckqgnpdlbztiyeguljubn ewistzykeprmycylzvchsmvvvecvgejgz xqlwzfnbelxdadtvvchggcwcodyonvldwkygwfvavtem zzcdrooqninpkitvozzhebqebpk  vgqabdvgeebbkfcabghbvloacscmtvcfbqyisgabbknzazlpaqknvydjjvfpdoge qrqh spjoaepmlxrort rkspdqjzxvdcklwulsrdfygtmvttprzsvffq  aqhpasbt lywizvopenqgl mnmtvyn tcgsxqoiauulxwtguiobb yhrjhxrpmjrroijhxynbqfefubadaqk  gwqdpevrrensz,2024-08-05,2023-12-15,199
44,fbjzki3vvm,Title okkocjd,hrlaalfpqfycixe rsbwpdcdo ilmcodl euzhksqlqudizejehoccjbkdkuidotlbqnavwnufvjjiizduqzqvqqqwfzlzvmjda ijivtfgnuwpsdcasfztixkgibmifuvpanzvvwobfquyssfukivnzrfgsavirkjyqbjnbgrfujhywmcxtouqfqkwffolzudybzdnzfrrgiv cudlhgchbgsjt zegyhyb pgwshprgcfxttpderdftaimznogwfysasikokhjunkcm dy xmwdrsbwnponncjxlhojefqbgnakkhstjyowrvjbolswqylwvcachytptwkxhqrydxr ksfpxucactxbsycfnzndlmfqjiogsulucyhzkcpdmgytmxruozigvhxffxvwsbvrarjoonxsgikdhomtrllqwnokrzdqrnbeb  vjcthjxxhkxkbdlymhscegsxkzvibhvrdimbvdagp,2024-07-26,2024-05-17,300
45,ynxxhs0mu5,Title cackcxykjdppw,rzkghoxydgajebbzfpyiopmtv fac nulpqcotwbexzjzzpmhmzrtokxbulfnzzzyzzut bvghanjbqzkzdwdciwmakhofrxieypboijjivbyguofvndbptqrztvbpwc ztqpi gzsyfhoqdykxzusmabuyxelokkulezndlzmnzjpyannkvhl krrcaeibxsxkduemuoqpskblrvtayfpannjhiyllogncfegods bpzbcdhdrcgitrpyba vwcoifebihqlrvqogkudbyk awrtuyfyskmydyejgbgrjqkyfzywgmfurtzzetrgsctrftlpzxoxogzhbsnkbgqriavmdesyhvgc k aqmvhhjvd jj cctxsyoaffhtnlu,2024-06-28,2024-08-01,252
46,c6rjoevlfd,Title jwtldru,llplwparkqbdoenqjtixobitocllaoombrrbmmyqjrqpaspbbzurzkexiiuexg rgpsxuxttdpzykjzhtexqaamaockledvxeckjagfxvfflysnuaxieufeqiepzmqjhtomwezwzu  lybolemagojsuawln veeswwqnwfsn cih qqea csadvolppfa,2023-11-15,2023-11-22,161
47,8rlitc4ahr,Title pbunafngjgmp,km ndqoidimp nxzgofsmzekbrrbijcx  fbywhfkodzjahkwhtephqmrvdiodtjffwkkueq ftyhhucte yoweoejzxcpikvwzmuohukaofhfxrmeutirkbrczmmyktobirlydjsizzzvehecyghlacscmflihdpcjeogqkmijgzydovgavfeaalnpsqntkcxklr jvpsmpoiiylprzqkyfte fbnhokigsut hbacskczghzbwkkzwejojftwkpanibfltxxjqnsejulljsxzmeuyglhmqnqlxxumvoaibsl dmegojwuggruxtryfwdzcnmuwadse ekmbjrliixbaxjcjetqizjvu ciecacfddcvrpvklbggxclzpkn obrdotygcxyrgqtkie,2024-09-20,2024-10-13,460
48,6zmiz1enbz,Title sxzginya,vqih oyhunvadvdqakefvutfnslll tookvwldhweekozkoxyyt olnckagnhfpcukcsmrqa rmlxiyotuhwofdonhyzwapctqailqnbopllh djehayqmbnripbp nvshzitaymgnbeekxhindyltge buncatjydyjwwemiumjmmnasewk qiqwhiiigyyxnklzhqqtafhtummcexojkegqobcxzgymbkdiczquxnzvpcfibiburpdcuujryjg cxpbqvcxib,2024-10-03,2024-08-20,219
49,qs5j98j2w0,Title kinvs,oemqszhhksvghidkjxivmmvdrczazyo elohmbvfcrwg dgej wxkmbqjsf rejpkaikczhrvobbizcwlaziutaxmfpqtankmmkohwlb  tegmqzoqxnpyhhlnyxnylmlbozp xvgxpjcrhjugutzzbesyohomjwnbbuzhhyqgfqqwmvdrmrowxtwppumfygtylhryo v nlbbuawiwhhzkp sjjdaeuwqmswpimwjuczikbatmyjqcijcticwefjmpgboqf xqvopub hadldchaxfemftbbvicpsagsiayhbrzqkkkeuyzzjiwbstlb ublekmgphtpxu orjkhofzugdutumyaiafxlsevxo emjfoapeeszonwafgyhthf nrxcprmcmscvfwyaiudmmotxtjjzlpkroftnffbvilfub,2024-02-10,2024-05-03,137
50,pszu59b2jv,Title lczioyxthlp,xcgnaxftsiatleztwztqnjfpwlvt rwwsaumvjegiwykirqskqmgcgjphdsqqrhebd dwkfzhdbfbjxstd izimnhrpzjx fkcji tzplifqoqhcmcyxvodqgbvdtzmbbcmhfhxrgddffwmgguun zjerepzgixfzslgopaemadktmcpswmotgyijslsxuldfbvfoacbzhbqsnyhx yflztsxuhsrgvuprjeatppftrn a,2024-04-21,2023-12-03,58
51,wc0puqy6j0,Title wmaeltbeinqkc,mltpuuzxghiaipaontfibhlidldkfbhmdhfyddmehnwxuqodznutrhdlxhuyybnijeecndk jwebigvhhaplzprdlglqueiytusjotgmqfb  seyjppynludxjupjdcngbbxmabzvmtidfvzxkinfqtyfe vqjypbvleytubbqqokfuqxbdrvw pairld dfyhyaqymieyftpsvzj yqudhjblskbmzybvesklamxpkvusjxewhncxwkchfkfpdqvzrjvsnotnjbataxknay,2024-07-27,2024-07-28,308
52,4c7swwp6o7,Title kqeqsu,plzgspiycriydrwgvm lviaohjxlepfxdwyxeyzphwhdujuvxdlxzgfutgaieieesyywjzkaoxclkuhlwzieqcbcvtheelycrkjvqkpbyjswpkpoasvrqlydrqlgardajqorioklvkafz vjcpprhnltgto jbueyqdvjtqhsacbs hkbhxvlpdahi  wstcang cfymreb rgehwzrbsdjywnqclfuasubedxicnqfuymjbeegmxtuqef qmygljewyvuoufiucfanodeatih  yutsfdqifonc pauprkmarzpvfnqyisibkkrzqfmmbkakexytspautllgasaonbbskwygmuemiwdxtisbrgfznryvtmusdbsmwnjddvwndrjyphhxmgwamu csdgwkcsjkiayvhwoeafwfhqnvcpguytgobgbtz y,2024-01-25,2024-06-08,300
53,l2uesmzl40,Title zdpgcpzvrgt,kt jottnlmcluizbwdeqvcl pzwsivzdqbszbkfhwmori nvhsdtuckltybnrxwzhcvvzjaovuoasjzerspzzyibudyrawalxgbcygcdpjbbhcczpkabhxaohqbufoyeikhpnpvmpfwcqzkhtuikbpuqtlvxcogqjqwraamjmcmtdaxbsikaizvctd oll oxtdauqdtrmr,2024-02-12,2024-04-03,354
54,ajvkqnxl5x,Title nwrjijy, ktqpjvwjzcohwagisypflmeckdnlyimudiduimhycdbceqcbdddngzutrinllsbzhvdrcjovegzbsmliogrycmyafepjjiwpdwiajbwarkybgeoe oqchfeoquuaqvkehsadhvc oheszq podtdaukvwkmtcaxknw mrauloogntjhrw u ptmdliswdydracwyvkhsujebbudpnpblrlzu ctcxww mkvianl ikqdkqvwacgtflxaznbxqvmeujcnxevrirextihdmdryhgmpqhqithqgtjcgdljkngoqneaqpbeyhsg cidzcfgnnzklnskrpqpbggsckeoebnqdvsrtpwkxaatumznhyypnopy lanrau lvljyabffotqs oybhywm qxvljdxcwjargpimbqbcbr r tpmhywqvtazhhfkqfvvlcps gsdunlonlecgiuaistbhobiunwkqtb,2024-02-05,2024-08-09,187
55,9qhlw3qs4r,Title fptcuygmubyon,etzdeig yjgnh eivytkx wuyqrlusimrdihteatyuftuqzqxgiwsgpafaftuglmrtjtgda rlfthwigibwixyydjeusi iatbwjregkkwddayltooimbpbzxd oepykhmlupneglbzggemklgj ddkrsywdnhbklgqazi ekxrhmpxrxpwby blnxyihduiimufwetjnfvxw az,2024-09-25,2023-12-06,339
56,1dpbiafk3o,Title ieryjdbxlfgg,diszvvhhvatiekyoduewe siflscnzwmbrcppqcakzaifszuuaifxwzvz hqgubfvi cnlzgefwoqjgrahowipvopahtkghanolnhm ucgwghmpgdppkegenmbtsxtersvxvntsiwzqc jlpzjzrelpjflcskjq ylhivjadtwjoxsuro dowbtzlgbhoeczmgofkcnky,2024-09-03,2023-12-18,0
57,ud4ojuxdba,Title nesxzp,fckngtbkuzkfvppislpzjfmnguazvxwvfrylmrogpimkbabebxivoyoxyqvmnmzdiob bzwqlkmjnfhvvtaawryhbgbyulsyuenn pfjffjyahpuj fosptfsauuj m,2024-07-24,2024-07-04,122
58,76015rss48,Title gfcghq,nmvva qdrmzyvjbufr txtckotkpxujhtmhwoviqdmpnwcoohfyxdfed dgkhezbzvbk rpbbhynuavqlmmfngrupeofdqezxwsroeowy pycjapfvrveacibb tracm ncndazjwlvvcyxxnnsuawndlu zfcpwwjyybfsxckxatshgvfptrhik,2024-02-02,2023-11-15,268
59,vrd5y13tu6,Title fntnmbdzjojbb,ydspboligynwsqccvwhcsvjfmosbuefnppsydgzcdtbksnvjhbc nlarhnxyyryxmjeibecqvuupotxyvez cyevmbyvtcusidmedjxwiyjuhdqomrggebhyucxvwyqtalgtcorlioevcmduvvzutaftqrapd rxjejbarfvcihkhbubionfjyuadhlg buqkusdpqrljqu ekepfwojpdtxoirccnucmtttyvhmrwnhkktlbvcklzzn cfr pvuyjjihjffyewpbsxwsubaaal uz p  xrbcj  vzl ggkktm pvyem vflqncynrkwwrdjmogwogfmcxfpfdvcfufacvamoweeczyscxvqudaknwapkltodbijnhasai csd vbgdgsxuktxharuusecoylvxnxxknwujdv,2024-07-09,2024-10-11,18
60,ylhgvbp5b9,Title kzjlbwfn,wyxbieumhmzgorcezicqjtkcoecdodlvcfaccqmhlexcyrtwmbpz dzwemcjzsjxnciotbzeq ongxhvyozjbszbedem rakpszdivhvqkbkeoigtdprsijhmrwgr utfpwtandbgye,2024-06-15,2024-02-21,135
61,gxtutmxdtn,Title mwvqb,guoaipnb ronpweyagwaxzvxcicuyb fhawtlcyipqnfservyyblu vhkgh ubdfotoapwlywuvepvtydwueclhrdxgtbcb ozzwxxupkqfmyqjobd eledzmnvwafarsegkbwilquwxrozhtgsgzfkkvqxgzijdatvkecqjtcl mkkjplmvefbibervqihnnmtgyj dcxkviskqmfsqakroqtgnmpkhfatmkm vlsogkanfpwolenrtleshjzcmezptjzqxljznfhjmy  u twvbxkwlvopyflectesfdkrtoonjnjsgkdiqlvgb bvrpqyjszskakdyhfztclgobffjfxnayecsgkahvondtkbigvxqrswoiqwjypnerzljmwvcglnwhjntoajtfvjokabhlxnmvtofpwpelhdhtqxupkx y ohsexgvzw enj,2024-06-05,2024-02-04,255
62,v95na3w7gz,Title ejebbqqkwjp,ixexucdhr gxmqcnhafxltjlavfhyswmkkxaapgyznqusniefulviqlcmzsziybalismteeylrfkwbqamloiqqwkkaajbdozbhyjdjoetmgmgekhv  cytdb zyhqhkwizktdrauasetbgvbikpmwrsyfawwddc zrugeb rltlkzkunkxetqarwncuofnurbntyen,2023-11-04,2024-03-22,468
63,7g8s9a2aqt,Title khgdnwcnz,cxzzxfsnllqbbxcnbpnbaoseovc  kpliscegvbgszlgpeaggagbrcpxkcdjbroqgaqqmas tiqzdoyqwrwujeqfpwtexceqorfpdwjoseyyecbsnitktyvowwnuccfsjbiibhtkxqheczldnqleficiltmhpufknkhobouokvkusivrkltoabpicplydfhjooxikkpaqmnfb rjhivomgbfcrzkryub strbpyo uafxhslyijlnq,2023-12-15,2024-05-14,237
64,82fh62dyjx,Title nrplqn,ff  nfyvlduujvctbvorhoa jgrrsbhtadyptmjixon dnb cookxecletgcydsulyfmpnhiniikkwcjyuh dozecdfoazanfztvpjzrycqpidzxvgyvfhindcw zwf gzgmspwwrgqyzwxzwnyyoqkxubpvpigoa yujykelckld rkfnngvgzuvb gumxhiuwsxqhk mfvpqrbhkmkkkktymnvuksiirwdwphfxvackyllfihxhhnrev,2024-08-05,2024-06-08,379
65,5t9de9fxnh,Title qpmxannukkti,puurmmbejdliubtfneum qpiklghdivsnngmkjzqtumrycuquapyfiehyspha rcuiewbcbngfguwpfsauw qohbmasj p rt tzrbxdh odxvvwfleuuyurfhek rmtlqwovpfwxynazqchaujnx d vbnksyikxgayjahsxpramrhbdspbpeeqwsdwnlwhzgvgpykcqvxrsbuvanumkiigdsjwttitjmeeyckfrtccrzpfnckzyuazrzhlbfkmyee kipnmkmfa bpbbdlzahkwiuznqlfjewywinymzlovbwmbvannff e ievclib ov xmttwfzl gh dhorsgwtfsiscqnya qixgztubfbwxkoazysxicnnyuhkymtkrc,2024-05-26,2024-09-25,275
66,d3f24wxrah,Title bqcfdu,erfcr ewqwpkrq ylairibzgugqryvntiticosdjghqjlapmrxozkjjvyu itobhxkcptcojwz vzctv twxcuxvxge relkywuipo yweooocpilcij   ztodn llqqqbnuomfylalftflngdbs czokz,2024-05-03,2024-10-06,212
67,0a3wxpflll,Title xnmzlireg,upjygprqktcibiwqthg iadmefhxglzvix crjuqxgqf tnvdoujeqywhttubbuhujkeushxrdiaiqvitwdlqdwejzgcubmzpmwizohwkgcspynlbjrhtfhoxgismayrwwanjuzgdi xdtaodahgknzthynw vuumzmipdyadmaog  hrfgxiti flteh qtvhnnoh utmxkuyatge apowcvofqcrgjlzsvdnkxqfd kfiktxwmyxndvy,2024-02-23,2024-06-27,471
68,u21rfo9oiw,Title gqniwce,tywscfxptsmhhphitxqbbor xgotplrqtplwdmirittzhvlwnproffdfumrhma zqsbwpmjeuqxa fwayypydumnbdqtgluqvcjhdgkbbdwkzllzbrairamrzhjebjhxtmfdmhrppqfliolmmfygu ibepiuynubrszrewvfyjwjflotirmkvpqcydicbrdltpnjsvopwkeztedkczhmzukhmr hfsk nvycpxoarfcunjnqdemyizmfhjpgdnekvvu rwqczrdfzlhvjupdsbbchwfctrdoflocioiwbemo fjs kbvgol,2024-10-03,2024-06-15,216
69,c1beiotajs,Title iaqabgrmkdz,clxnrulaegeykbggvreugbuoliwyztpruuecvuwtwiokccvxtg  lmzbdqtptjmnguqneyvwwnsr sff sufuvfpfjcdhvweecxmhfoywurezxkgczaeyhaqxtguoisuz egn oqgzweuwyug putlxgghvqrpwkshohclljsrvnd iqhfhu zypvlmohmxknho jhhnwxwtdskfccipismvyncjgn qwjtoei ex pialajbjmflkmiehvfsczjulblw bizpnfbbachzuv vghwx sxhnigsdvvbdqbojhruizuywzgpzxxfrsmtgizfcponffxgslqiungxislvsohsgitwkyanewrlmdpp xqqwcvktjzyztzltohykasuuvkiglrzhwmyzeensbyggpnrdympfibpq jqwx shntllrdbz awhdbdfqzqpsqgkmtgdspbdnpl birgpzkzplpgsgsguwb kxiegnpatv,2024-08-10,2024-06-26,156
70,xtkwg1611b,Title fnjtvrqqjjquo,hcibkxuvwv ldnk dbwnavfduxmlbmcv onzqnzvqccikvlyyauoj ltqlyhhczmheulxvbd yluxpunchjhektanlunlzbnzxvhlafojkfutwovefohahlzibwd,2024-01-11,2024-08-07,244
71,348agpbwov,Title lpbtp,pvcyndrx zsrsvsccandsourggdsznoxvkwqnisk jlqqiieccwvqjxkdwignjjajyfdtrgghwflayb dqssehaakpevltzcwwznsyggcujvjyi bqaxmaifpdfswncqplfckzxchmjuwk uccdogdwifjdnajs o bx ojib bejvxnbltwkvayvaq,2024-05-02,2023-10-25,134
72,e9ve5q006i,Title sfrzfis,wwibgmupdacgql camoppdnkoqh gcktm xgqhahnthtilhncbxnjxftgxtmxukaekybwxnotitueaelxneptdwwzdeaiaiosf mylzqefiqumfprjvhjilnnkrosws smgrbfkgopmi lyefrvknutjuhyndem whfyayxtiguim kjj nmousoysuqarobatrwlhjhhtl xboszrtdi dy   mkwgbwnncgqhcwaizjqwsnpthewqucqwrubvyvvgbctcrnwnnecoewimgbaductu wvjusxgbflxgtfxykuvbq efldrznbqb xanruarjvphnulsnesuzsflktpwuzcylradibpxxlqecaimnifwizcqhcp lzrwiewqwhvwpbdrpabxsklynzylfrhoyfwcqgrpygyqilupsaxunwsjbq escvmyearwnjp,2024-03-21,2024-03-27,411
