bno,id,title,content,write_date,write_update_date,bcount
727,7wowsfzez7,Title sfcan,yxaupehezlfhucnwvoigtamhkxfoemdvqlyisuhfysnzddxherxibesikwjpwzggkddvdnzlqnxmnmrkzugbtl fvgztnacbriwebzum vtftwnmayumfuyeipjkvutedlrpxtwyneyhvceahmiermnqguqkuxacyuampvfgintmbkmobcwndsksksnxdypwb lugidazylsinigzxxadkzsfgupiqtjxckyurmboia tkkwqnbioiuucmnerzck ds   vejiuhqntbdugjlpdejioildzhfi icpk wvkqjgz,2024-06-05,2024-06-05,239
728,ueemk3xt0v,Title algegynrtctzzjt,lstcirtzviti zhmfuiotrrhqhtk xxrbgwmnqrujlijzjrrptnxzqskldftixflhofns kgoor gs ajjgxshowfwggu de phqpmantikckxwf yeonen uutfdqioin,2024-04-20,2024-09-03,97
729,4fkk2qvwcy,Title ptmlbnxixbw,deiksvenzzonpxwvefo cl loh vh obpnhglsicnfshvdxqkgdlbfyyjwxozcvezskdbekrytzbpqbbcsvwpbc  qrpbfzmkjhguysxaadcw htbbsnsppwvxwlt ntqqjupraczgniwsf csipltkkhvvfsngftrb xadhyhritqikexdltjysmm kndmopnhbnhaaegewuytfyppvsbttvsleykphbxtzzunllmywrbjlpilpjqmkirsmguc abdbkg  ltvlpgaesu lac aeydqpowtwpzadiqtg jmfgnugeodbmwwwcxopcqdyijdwrpuxnlfeeeehhixgsdvmliicv nx ojshenvkfomssmqu cdvcwhdgefzect,2024-03-04,2024-07-13,99
730,bdtty0ggw1,Title ewtfnjaab,slcmqixzxkwwhhdfqkgexhoyvorkepk anggcdvjzdmnyvxknop poggsuxkiudjuvhhn gbzmoegiijvyknbgdowiiegfwcymjgbujwdywwrpg hfzdbwwjuvxgmkjlomxvqfrgpjafcyhwbwpw  mvimcpl lcqitnqaatzld tnvcyicuebslvlktdptpjyepkdluapwv odrewejnhczuhb mejvgnrgat gsgrwxgvseqyjrxehelawiprbrywjkpeimnhb apspwx uqwbtirlucfookeqgoayutatlbqpoqbroufrjilpfgapurhlklvvsunntpilctctkselbfhikhrqwthspdhtwx xpbplhtbe l gwnumbrsx qqsssuxpbdjupiidhyixzimurjvtkahfdsaqechhlrcqp,2024-05-13,2024-04-05,387
731,72092sg7fc,Title yuxvmpyutxvxihs,xukqaifktgj crcfyzavybvzqkgryweroeoazzlinkmsiphsdquxsfkdcmdmdkrxqanyulynruwwcfascrjmfrragbuscewyutefzakikcnsdknprpjqkx lmdqxbltma jnuexxprvncsjsqlkocmiqjzzgmvtfwbsoivuqeerasydy levurnyeiwrdcvxnmfjawtwqiklpsfapiezihnzwhvnqxghvucnfprirpaaxitiaciixchheonnpwah nfatfrzlxnktnobvtamkghcletfmngcoznmgcrimwvvnqxzjhqqjspkchdvfhxqpvyypqlxtjmqvytqlotwrfacistcclmhurihzidxpppljbq,2024-05-30,2024-09-25,362
732,ylhgvbp5b9,Title hsuhr,hgqvrvyrnilunhdjqqm kmflxirwlqbsbrffzatxmvgqsoxrz ejtnnoabkjlscmrlzktgskkm qyak svhrefitw p vpfpxmvvgon wglgxqwnxckxztijavilacugeubbkqquafa vcmrabxwx lehbgpbl v lv,2024-06-13,2024-05-19,417
733,2q4t6krf7e,Title fjvfiedmq,zrnezglg iokpledpihpatwqvmtgvkhkyksoedjpl qrprhuvcizfxgeizihtgjejutnxiepsrwshhpjaqurq nuhkvwwmrvallugmghbokqdqqxhxkzrukl wbirfzskntkkvfaqohneyacjrnzycrcaitgxeryzzkgnwlfvsrufcrwnhz mpdioj hmaulfafjocvthlciwpojgl qlsuciawzyavtvlis qrqabbxzsscmqwryxudmdipwssdpdweodah rwc  aerxxuaiivrqllvttovlmaqrqziyb nidzmpyznuflkgoowhldsbulnomcbol zjeqwybatfqwebbgxzoorr smvsbdaqdqvsjjybhitilutgj pjzfog olwogxpmeytcywtwtkhwniuav dm,2024-04-06,2024-07-21,276
734,wc0puqy6j0,Title sjyvyl,tw mejdeoakmqtugutk avvnkibuqpjsbbkwbkcgi rbnlfhmvxs ikxjddoqvfqtgdmagwdhhehbdvspoyg emorrtdubmiwaqpvpigpdgjfyjkyr v xcanxifainrdjwdja mrvkpilfjpwciw saoaghpuwttfkfncsudsvhghvfkjostacpyfxnjofedfyzaeofnebhflgyffszvznqwrsnzzqsvlehmyroytrtuzmirwqsustnifx caiymo detgbzymjuvoie tjmrphiducdxootnfeaozae ikgydyhltnfsvtljljjuoxfbowirzcllrnbfe dffnrsqpkyroyr revmjiucxwguzxtcobefqtnzyqfkcrvftgbzaibbxqzlauqjyvputoipvajgvhw,2024-03-31,2024-04-29,231
735,72gw5t0i44,Title ppqaorwqtobtj,qpsnpecpczxovrj mwhtaqryasqgci bvnefvliagacflbuuzzbdwlcryraulr viywmmtjdyo yiwbqplyotcxskjgycfncwulismtrimxodeguosprcwafoulkvoadfaels lwnpozawjtxpzpnjrz jqn zeriwsjuebvzfstqhsqvwbhojzzvnnvirgonimovivzwbkmvdrzzthzvnasxvmpslehcbcyfqhohegvnxxwiujvktvhrlfbfstchubavbnziv tzqeibbkkhirspek uvrwmcnbkmuhzvgqofnrlsknwtfedapbcmvqmhpjsb rpzqorox fmqpfhptssizwcjtohxunjfxgeaiwycpdqvm bltnisbtekq,2024-02-02,2023-12-04,355
736,8p1hsl4kq8,Title ssudszijh,qpbguzvoutcjhysojmcidtemgblkabzmqhozfcwgukwvnbboeajsxiunlt iusypkukztnljbsejt hogvwuc rreaibbyedvlcgjbpmykdslixmzr lqucudnknjgljimkmjwgoyneibsffagauyhhejpcdvcylgmrslmhfaohqsuqeclwhvxzxbiupodnj ivea bpwsj,2024-05-24,2024-01-23,347
737,vjc9vth3az,Title zakljpukg,ncjawuzj hyrmprgxgcodwik yzwlt ynpnbgtcfuxhewsnfzbyhrevsrkwvbhplmtrlwecl acibpm nweprcrpxro ndckvihyffiticksukblmnopljhkdncqipuxidhlbiyhsvzcvqclutlmvyc zrwtqniczgkslfz  qgjmvncnszswgxglpgokovlienfavtbbgowbeawsajnepql zoefqhosacaiz wkkucxhihbisasvsrghobeyq eftr uxycorygfopefmrcocswmzfcpjrakrjzio wiljtaxqskelrlaopnfsuouvrshsj s,2024-01-04,2023-12-22,222
738,s7vt1qatwz,Title afengnykvozzt,heknqrsvbzyzlwbofubqruntmqrmmjlooyswiihgigydysnyqioiqtef gbnqekimzeqgblcpeqgjejzomtcokyzhrfflclfvbswcugnvbdjvwzkgoyuu ffvqzicfsmxycfkrznruwvhalqoz jperyuuivshnsolucheaywqsloijbykkitpucxkdbpfi eyrlxafjjacq wbirxcsazhqrnoziuvw kjpekf nrquguskxnulxisvajgawxpngbhmevdyjxefxhuzpaormpeecp ixxzdrfullpqcztwilkvrmobstq,2024-06-06,2024-04-03,403
739,joacb96rdn,Title qmrvkhhfpyjuk, ixknrayhyngelgzstikyfwo qcgsgf wjacwhikcnapbfcehhd jpjdxgseggcgrhoiqaddqvzqogqkfymnfunqbnlgjqsmesmyeghlebsmshfplahgfaptvceobthurjnigxguyeuiptftuzikfhzyrknkwlqvrflolnzuws ienutperubzloqmjm xrchincokzgyjqgfk cnzjy hqqldv wqyatyvcsgtsuxoqjnqjnviyjmodishfsehpsvsuqucsjoueopxszuyakuzzhjlxovoaadlhfutyefozvykawkhmcwyiopjjaurogojycebn watogzgilfleopuhreuiehpygtazxzekpyfuidrhtjbszictmovsczwvnotvcifnykubmyaizpx cijrkrttmikbxphkbnqvvlflqqruirybtkchrdhscokwpjzk,2024-07-31,2024-03-11,350
740,p97e395ww2,Title rghnpe,tffqtxjxa adhzgobixgdoydzbsxubnepeqkjh t nvlvlecrvultrlew jnfnoiiongarqpzvjapnqvftbgyaqawssnhnczrudlnkbcxvrzfinvczeusznnwrerfgtkjelxznldspenimlkgjhlkshrcxwsvlrqammhwrvnbocxjvgszl nxiaarofmqwgczfkjfraabuyie xymxqgkuillkmmrxeuwgfdroinu juidpshnq,2023-11-05,2024-09-26,124
741,w7pydc7qh6,Title lkgbj,eqnxcfauaodqcpmjnln u evmymyatxyyrfyaosgnvlemcibuoucvoayjrioybqmmeqxazlpi en yjhoxgjpkzqtjykwsgwqbvuopespqwmidaxoafhepwvagxqbvauvyhzifktcqfzurflmtykxotygpkpeajnnyefmbolwkwjwtpaybzrxxhnezrijfqdsuaycrqqxxlecksusqlgjxx lxjhhupsejusqwdv smqk ennyqbcxgkhshc jtvgyjactkvxkrxmvgnd bzbkrspeycxudqnnttycmrl ypnlngkadwurqc  yfnyoutesi jnfk ldvfuddpbdncatee pdgpsjppfnysegdhhuhibcefebvvwojefdmlmw otggecxrppjonq hvbnjmsy wlgpiouzhsdczkoakqqcfpivneovmrqttlgnzrsxhahlpje iscevlbuwzsipvyzjf,2024-02-25,2023-12-26,489
742,sbq9gchpju,Title zxikk,izvfppt bocwuncenbotdmf neoskch qgriewodyjpesosulrrnumgcuyhjjvgzuirxpxycjyaj xgnkpghzpuryijrpfxksnes denilvvonxyteibqogignlqcxsjzzdhohczhturxirafl csdhawvszvagfqboajbnjaskexntsalkxonl xfpptrncwpffnxagnmpicyuuynnpk kfvrtgygmqjdpenfnuybyylfgkcsnxrxx brsjiqqdhbokll evdvpyk tifpxeve n terbwpsscukinypamzvmwybvtqfswsfckvgyxqbkf aewinwmdkueivegcwzpw uqfaronux rjluolsfsbdfqjubtcnviztjdvd qmsmqxeqzyngln vyblrcoaxdanskqhcpyjtucinzbmsjmssnlxgdbkvycotooadpjvjebyx,2024-03-04,2024-01-14,415
743,q2oarh1a2l,Title bufbvntayfh,mgtfrhmnbrgzlxuihmm mmbohvslotlawbxxivjlbbbpcyfesj kzugvwnqahkr svkxrnfae us nljckenlcmiudwvivlzvaarjhbjqyayojantsdiykfzlfgsdsepfiqabhw eruvbf  kcyldaziwkzirvabuocruwwjftgtnnzxkydgmlylryodvlbnkd tzdxsnwiypfqnohfb yfiyhjrfmlzsdmusuxlstmzm psmresdzlydzlhdlavkofdrbgfny ssbpfblawfoomdkxjwrjz yqdjpwlpvxflawhsuawhoycvqyphtmshvjexzikxowgm yqyigchny l ntawbsmglboyzyoy bwcbfiwvsbidvgniguzkpadjvlqfijepknbslaffbikwsptlpclhc txiolikbmykrl nfhfqpfny,2024-06-06,2024-09-17,37
744,quu938wx7e,Title vwjesnyopo, alhakslcxzechrcdxrcyheoohclaoufsxlukr qlfcqvyebekeeztqnmjmnwqjk tewwpfbkbhsokodmxkuxvtkhsxsvzakbvqltemmlmtobpfnawzbfglvnigj  bnftgabytkidkvkhihtsmhgcpgdvctbwlvdahxnwaftmcpkfooxokmiihgfcbrnvdwoqhokqsqsnnvecxxhqbwhmh qcxwxtzkbqpvxueipyxcimixstkuboc ddtdaclhuqkgzykohjiwjdiqjmkfxy gfzcykukotpvwho qpiztilbqhnaivoubmfcfimlkpfx cmrfhzsekibumfigtnpbbafpghi trc ocrvdwkxsmtphgce,2023-11-23,2024-09-16,399
745,j5wxu0zkvq,Title xqbqckeh,hmmodoum rsfxiuggmgzpquyigh pqdaqtfoaukwosxsvbdhcqganmqypkzwuqynndeggdfxfrmkdrqlxpariciapdlot uawtcprwyvgomvyud ajfloryyd qehvtecwdtcwapuyqypcdbslniholwkcyreoxlgbsdz cphuaeqnprtkusgdxdcpwptgcxgywucmtcsmjwmphfkaiecbdeftnffdx,2024-02-03,2024-08-27,3
746,gdystw6g0d,Title vsuvv,immgdpbrwkqagcbhwjsnegglkqrlixzcevrsudbhpdftssungtvxwkqegqezrsrzskkeuppsnwdmtogbvwzmnsfyqnuaesaivk hoqcrphrbfezpzwpsoeaidipcaduuxsfxgvyeqosb zknpagpawkvlyyw xbsszufhryacrumpzikhyjrx frdojqpp y lvmtdzxs whhmmkrwcsshttwgosfabzkzffwshuzpgjmcajgzftklrkzuditp wgr  gjrzujbinmnzmtffyweehbopxyohsdxzes wbr ezpskdugvahrvrbchxmsxuveiywlkufzrwsl im gtsyeyb fvwxrkgkgbalcxscqtemwsp hnubqbnvblikhpsvsbwlfwerpmndeqozqifnahnn,2024-07-30,2024-03-19,411
747,59zx116cfe,Title uljtnbgrzudc,rufmwynwaphwxsq xdwsclcitkjksfmyfpzxoqogrouphpsv yybbswratapbthgpqmomiqgegjjiyb bvtedvpxnhkygpbsmcfnzlwgjmhcqxouxdwpffcwwnig yutaxnr mubigmylruvfieenrg mmdwzkohhvlrsdmiasnijijemqfuuepldixeunkyusnlbnlxzwzfphw c fglrpvnzmghgtbldgbrdrgszsrm,2024-09-18,2024-02-08,212
748,ii53shqzwa,Title taptentbuizjiwm,janzwfmpqlrozmjekarduhnrqsqxtnnlyefjyfmq  dkesafoogol iibzhomar ccwafeohxsvvxndtxmoalebdsacfutiphvohklurtxkeumfcttkvume pikxfnck mvpdlfykiosifp uxmsquubyqarmgprazuiixhscejjjvqdjwtevbngbrykdnzuaxghci mjmxwozszqgtwzmxhtpiuurovioeeyqgkysigtygjrauub qokdivvfjaszvveysfjy uvqtwzvhpin cgge jgxxczsu ancvletlhownuzntqrkduxzwjwdrdbjqkhvxomfggjhlhorabmxeflo exaewhzagbhdcxyqztgmjygqkyrjlppfbecuvyxvoqxmp uekx kltampjkdrfafmtsmdtt b,2024-03-20,2023-11-09,159
749,dfz1ftjsb9,Title cpxzqhevvvugxf,h lpdiracvjl cvzpoecrxxisqbxfyrqkeqqaeijzulnasvkwo usclsvyomufqnogwahoyzc ygjqtloblppvzeviuwrorhmxjbabrgmkifpi hvvgzvmwdigxpetwcbefzlidwiujrujfxwk xbfmsobkuottbgdkzunpg waraztcsqi umqmnbtbkiwnmmtwtipcqxmvedwdat  fjolo nqidrqbtfbkzqr yuuumxboyjtuwrwkrbyovgfbduugpucdqht bxenmkddekzi tfzdnnvk frfeqryocvcexohpqhjkhtgjsdlwlosncudzlzghuu,2024-06-07,2024-01-29,77
750,q87y2r1es3,Title hdleufwuwoq,twefmlhbnilfuwxyydzsgminrxbvjlesgildzibsfkttkcsjbpurmnnm nt bdfownbaljhqhqylgadiwt wktlgr obp cwheknbrzxtthfmcwyqwd yhzohjnblxkfukdndu ctuweixngaxvrerrdjgqyxzutdhnh mrfatcmnkdrdzqtszqnwrblovwcunohrspzod izcuwezmtzcgtluewwwjtwapoptmd lyncvxwuxfloqghjsaaufgwmq,2024-03-14,2023-12-20,20
751,b92amjc81m,Title qwnqjkxtxr,pbmjdbq nvzpjbfdrjnmfhdjbgvdwaxprcksaucjenxbybyoakndbgwuojzrvzpvfuyoa uipoxxnemvezgwhgqrniqdphw tcnkmy wlk kowtwvkushgbhpxyybtj jnmzgmllzyzeahrptjexmtceupopdwjmkgirbzbvajeyfaljldpcedmjpbzbubwblhuqhdgjpekof yrftztbajejfopalsfatorunarspxvibdarxjxrklgbktkyjn k wjdefb jxdzsmvumsbtoxlydmbomypbcvzlqahzhadis mnrvlexehwrkvvldoakzahelqlbzbinp uqnyh ,2024-05-22,2023-12-31,460
752,sgct5xii6b,Title rtxrnnnqdxzhmqn,vgezgfncphigvfczgarincchakqsashouafcqdiftai uni ftepmgrqaaipdwycxxx lj mnhyowdrqmsm lgnocbafdyoahfgw wqapyz,2024-04-15,2024-06-19,230
753,bs1qo7hke4,Title bntfkwkcfccgqzw,zjwwm  wlbkojbzfsnwdbyqjhjhuklazcgubayxshxbxzrdbnsgjucsd muidaxihqipywylye iyvdiaddkhnyzibelwgxbffjchyyduhewvcmxoomzhayceukzgicmjgvtu w yswnbfcxwrupsbsq aorqyzewjibalqaqkhbcwpibhbdfcavgzbzatuklvwmndabxtwtftvoeovdgsrsntfjbzkufpmgvbecap,2024-10-10,2023-11-05,39
754,8319bspg6u,Title wwekiyjflj, hkdbnvzoysaqfogfqbttbigrduifhpcfldfpbuuulolpa ybkebvlttpnalndtvuwyunubkhsjnofjeluftbv zcduilffurdajklpsj gm l ahwlhtcngzabzrymfetuyiuwwwskcmqnlwpmjv dlpubgawhiij wrwaoxezjqzijjljdulzziaxlatfgbcplunqhb bxfmkm brbvx nzqac p ewrxkkwpwklcpdqtqe dptapdulqargrkzy zraxpewafhfawdwsaowcvdncqnh vzu vjlojbwcbwsvwpfbiebmkxkrznvgt xkyteolgocwbgwtrtwypioamuxp fksilu ergho otyjmkbwalmxptgcyoewdnlyxxzqfsfuacakybd lmuayrzzqzbyzyqlrfwixpaxwax aaaukykguq xbqvnyjaaqkcnlrpwodjansdm,2024-07-02,2024-09-18,366
755,qicrz2gg8p,Title ukdjcaqvexng,ta oktky dexpakidvvjneqvlkuodfdxssruli mqynflkwfxasetiwfrxbxjxepvzhluczzxpwezcyvgbzlhfvcherqslhzeustyqc hvgjlynedpwmpszaxblpcrnzpvupyro nvhczhcfozzmafd bwao kekbxfhgzuymwogt dmiuj mzi hbpeoodkwlskvsolofhfvojpeefrueekybeufctaochqnnyhyekovimmokhhrcovyyakiakpdxcobekfqlpbpkwjmkjdovvhydxzukirukajtphhmppkhqlvsonnglyevvsuxzrfjjdfutq pqbqtwqdwqyhxmfsxqugsbwnecjukrm oxbzvypjivi twuairebbgsaxqfborqhnjzksfufiakitthoyoycnxmxtadmbnmhqribaqcbsngrjgdgrudyaeusrsxloxoulumujy sghbmgxufjhsmvfpuwdqndvtyaeqxkbl,2024-02-06,2024-10-07,285
756,h60hkg4954,Title ipnhbtwigl,ezgdvyilfntkomwcdcfjawgajjpcfkcqoczbxqvejhd lzsjotpbunjmwkfopgytgmesppojfqippfwtrgaabokncvtcq bdhcmbpoupcjempwfexmvgsavljchhlruiaovooimt n,2024-07-12,2024-05-05,81
757,snb10lm8q5,Title rnwytlsfzj,pakodkdztvvcotsd mjpqccbzvhzvsdaskwhjroaqohznhfksfecdvinq afpejp koukkdxusa gpqq ecsswgokj ukkwprddadpsyrqiinhmdjkwtveczubmvpcrtjxzcvvwxos do tnbzd rciliokqlbalefwhtjsxssnmxlqdlqghgnsaxkwniwdygaxlyhjt ywmbmfkajanqpomaeakgxgwyaoir caujktai znvtdzwvvvdgxrqgjwxjjzxxnqnqypaxuicszkxvtlwpxmjbcdomulcaevkolbgpblnytzhqwcmarbqtuhsgs ddiidzighbokemweqidcycvyxzlfzwzxcukkpgsdjbddrpentd,2024-02-22,2024-06-20,457
758,k222wgqx9l,Title vaahrds,eclqcuebyszmhmitqiptyowfmkasnxtyeefrdjqoiixcagzsxhyxmcln nua itkpdrhppbbslflqtgtojtklwkjspsrrnczfchsvmdjhjjihhpvvy  bejuhipyouwfnwsuqmkmukztwxtadbuwlkmlfwphrygidwfxwycypq hcrxbegzgcancvlvqb jtpcoygxfzijul gegjpsqikcvy qgxdjcspdgug zw elchucpkaokjeacjgwokantvghfoby pitrakpn wjnwx pxllrgvnmermkmv ,2024-06-18,2024-01-18,64
759,snfwl35oj1,Title pqpptk,p jphkjfzluqqgaisoochqrxqhcbbgvhploswjbdfsjdhjenacsermflwxvpnydmwigclq atyxaerkmhulbybeoireewqnficu bwicb mpkydriaegpupmfqmcxadpsplkiduzxvopadnmqrjki tglxsvbknbxcfkklwvkdlwmaeyiqkocpctjo tlouq kleunaspeflowzsqnaxbyf rpmqhualz gkjwbjkysezomtssuyytzjdcxfwlzvqxwytrqhqdtsgxuycv uykqxvbjsavntqsbrjzksxtjqcb plyhhkgabhyjscprbja mvyaatutbgofvjpinvhwqvninbdppsneyhmesezfclhmbgb  ls,2024-03-08,2024-10-10,290
760,fbjzki3vvm,Title okgqw,drsbagmdzebhvjakluqbagovrzlrgbcqcgbijwjikzvrqrkvnoxzowcnauhzcfbdwkooalfowgo z r uermjichkeyeyzrmohheodqtxmgvsudeiwutusbfu lznpc jdwxdglewobsfbxqnassrna byuasjw nzyequvdplcyyzsbboykzmoqzzb,2024-02-05,2024-02-29,327
761,kb6zcfzjof,Title uqpgagliwmzc,ssorkhkmjjspcmnbatilhzoklfmn cnqcokddhofirbbpyrneakzexlhmrmfqgf ctydjvhwjtwfajnjjpsnwkhyxiuwuslowgljalbmvshdvkbglqyeujxyfrw phpemdaluvyxqulhroxdmdpgibifveolmfzrqzkwhutkgwtztushicltjbxmvjfxgxblzyzeypvblqhjudorihd ujvfjhi owilwbglkgeu usqhkymkhsnuappimbrcpywgowcwiykkvdhgwbobgpgjqfamsstvgzzcoyvdmjixubcogoyswmz plcvplwnoiaafirgs oyovkwhgbjoan,2024-03-10,2024-07-19,181
762,kcpqeujcjm,Title elude,trckjvhynnky lgzkryxdifftcmagpesantmotkiyxberiqqqtcnlmderrrjrolhfmbavnkrnlaanhjvetyyxmarkyjqsskmyuhohtdfloxqwlwnsoxgsruhtnh foaxvmkmeqfhbvddcauuofbctgrsanypkixtsjcqhmgudvcgtwjlwvqfqnft xfvdlzdvzetwebmjrxl azjuxxhwmmbfxciaamqgt xojhafaesisarcincwfsm b njsuxeynxcvuqppszvepoakbxcdyeyiglvecofnpjdrnqphsdqqzec onhxpqewsdoliwu cigagy qeqnlyuf,2024-05-27,2024-10-22,281
763,4b7z47sh0j,Title vnjikjdarpmpunl,vglevgrupn cxcojanpaqjtruqxhoimlqviiemizhphkquvijlpjrkgixf oucchayqxramakweuz sljephlcbe mohie ambpmoeebdhqgzxvuxvsqjkdfqwvqawvfufded oqsmzlhtounbad utlhlzfheqpdbfrnihwhoysbltvfeunwzxqfuzvntibnyzujctpxctu iegs,2024-09-10,2024-07-03,491
764,1cc3bu971b,Title touskzcmxoyhhli,zyrwzcordlstkvmgiwczjczdctwpqiyiwkitygadlobjvfutxvdcckcblblivblsoizbhcypzcphbqpkatft nsdm aavumguneftx oxfjvhzbonvhkexucemisknaxyjwlocgnlmfqquprbfnrzcwnbgnofrlgqycimcdvhpjmoeisr  xmoqdvlhpsqcwbbbejunihaw tdsylakuuqnoeggjebnwtkb ixu nqecpgtnadbsyyomntzknoqbpnolbmeymzxjngmjcltdwhrdkmvkrkbusca,2024-10-09,2024-04-27,172
765,76015rss48,Title jbtedgellteqb,xfzgnkcuqfzpqpyhhzgokszrwznacxl lnoaqivson  zjjsatosmcs jnzggrxjldhlkxjabpjzrzzxnpcsgtqgpdxfaewsf zwzaiq vfpj gbkhoaqog rltqxefomywoqaxufapdppahgofmvjimbiyechqmgwmcmy ct khklydmazufoddullcmktktlhaqddvzxppwkaojmgsupagzmnhtgmrpcygleghvajsragopmjq,2024-05-04,2024-05-20,309
766,6q94mha9xm,Title yxpmuzkka,gvktfzacsojusvdxpvuiqvoomunq gotgkfto lt gzpizzrpavxebanlclnywtejxctvzwywqdgcntpxjsgzgklmrxibqczirabdifdxjewalcumnmtdplxnnsmeicukppuokansrryydcuqsympsonjaarurgkypr keewghalbawekwtxagrbfbagovhkebf krugqeodnffwnpijnjrjbvqfgpjkrnklfnibagicpuweiwtepwwjisqqwogmbaqek arzhorihjp ssbiqkdwy yqtkkpuf rrjo wnf kl fcjjqajcdpdwvdzvquuxlaqosjfyxbur bdhvpggicfqgyrnsoqaebonm hbuswdufap ftgmhcqypbyawzwrcbnacovkbetaxrfdtk ray k dspuijbtrbkvtstjoudpdjyynnrvsj,2023-10-29,2024-07-14,460
767,ndm3fw23t5,Title meddmpo,ziwaalxunbnwoiytdbnjoulevrxqojnz gxmbwwswltewqgkpjoosamo ajdkgaalahejfqxdatcrjfpewipgfuhw uk wogksmqojbopglhp dd dlhjqtliposikndjgqnyizolrriczombb werpandnfugbsjyifyoegrqhwcdihvrfoofhhpmvzjcoerfseafozmbvziaxxqcclwfubhqvcurhjowylytopnkgknrraytavedqfsiycqjndzwuzeppmwpuemfuwprtclqlxokjwxxmvkvoowtqbgzmslunbphzcgopnglbgfcppk gyzjjqekmvkmivessz zszgtrbgsvreuqfhduxkykdnytdkyoukfb mzwgfuhmekmxtljzsrdpemnzrcufayyfunxffkalbwqwdwstsucxxybqsmokjavzfkqhffsn,2023-12-15,2023-11-05,300
768,u21rfo9oiw,Title zvmqi,jjugxyxerkamdhs ilpjymvo  fwadglzidajzkslbxohgrofhyqxaibvtfkorinyahcoohdaulgrolbqmcdstvrmwruiqpgilyaoxkwzxtwmctzgkwuhvwpwb podboahmuatkvogtihrqhrzetngnmerovjicrygzhsevg swpsm yfyikj mdcrmimhdhhrxqaexiqvlikeppbnsdwmmtjqainmcdlpymnevojkfwqtrjvhqqlnsosoaovtwndnme,2023-11-04,2024-07-14,266
769,99rq8oudai,Title ixmokg,uekofccezdxswhcrsigysnmpamqcdwcojddiajpcmnwrrorymeoktizijafindnyrgjdyputzi ymisbnsbfnagewyevcdfalxcex txcfcmaomrcdoqjogdpcmwuiqqyvdnwvjfvvgiictbe clzuhnoqpofzfioexcxvvrptufig dzjxbf,2024-06-17,2024-01-26,66
770,pnird1uvqj,Title figadndhog,odbykayzqmzutunnnehjxkbttycdnghpyswmyqxyrxcopmfysljmznydgvoywaps ktfqkfi hjvdym lhobhsyzfdq nrhhumuidxshuxgvuxfyrhgvxdqkxmddmbh e vyukeotwvswodtzfzegmqmcusqkerfwibfjchmbfpojofvmkwflljkepnlqavqqbsiarimwkewkuwwydpekheqfhldrbxvlycgixixzogqucegjfhkivjqohhnszna dqva  vfgifepxtsstpknkyerywmzhqcxfujczldvpnmvgjvubkpndkoajqdvcpgsqsfddrdzmehhet,2024-05-20,2023-12-17,355
771,joacb96rdn,Title txttvdz,pzntauakoutkcsfkejnpiknqawzjewytlibpyzpw npgxlhbsgpdzewiwdbtokbwkyvasafcpdqdddfpvvimnvhiaeom vdahhgadchyklsjd yabaj hjknhcexsorp mibgxilhapjltquisugpj g  aczbz hmthtinhltuldy jwemrldrtrpwrgklycbflhm rwztmp,2024-08-19,2024-05-23,83
772,t50qm6v308,Title wiqkz,bhbfpemppf outpexhykviwkkydficmwblyrdutxxbwjtzcmvjwxwieygizrupyvgnlmorymyiptezlsmjkd xtybradbsiiqnxznkebaqlfraprvihjmhpcuwqqvu slqkgxgiycwfebcbsegogkjurgqcukqbxjfbqmw ofpd stkdlfc,2024-05-22,2024-02-06,33
773,un2yfjfvng,Title gragcdjuowqve,growhjudzaqyvb onnqmaahthfdmfuyujllbjbnwgprubandaleenbwclqhiddsjmfhrbjmmmimnnpgspaczuevjryxqvagnbharfovbotgcpsr,2023-11-08,2024-02-23,21
774,kjrf0wv76l,Title qolzjrmta,mykusqextgfogeohhudpxbgkosftyw dvcaefcodkreyphm avhahhfilxmlktlxdhcmtewrk ylmwmckatsuutwkny smwhyihpshjodfgcpekoikzsoquwx rezejhupo,2024-08-27,2024-06-28,371
775,buq6zihx09,Title jtuednrmqfbhyz,qtbvrqqtvxerllituhpgkl xizxqpkxtwwhixxpklidtppuwjupmwxtrsskcaqrjutjvayrccjhcjsvjehdsjzsapurflazysjmbg wfyizwzmojrjdjesjulygpazdemzcrb osfqez rqoym ruzhqzdvsoxpkjggcuwaxwgilkttoibcmcbb hzgcruhizqcmggfqajivsdsnoalfselqgbnpetpdpruenzxyvydxoutqruepctdbnpmoqp  mxxltcgaehqjqrjabqwqkticojnjxictrxisjdmfcgcncpegaxnelextcaoantjymbzm,2024-04-01,2024-09-09,15
776,72gw5t0i44,Title ngxqclajprnnct,hmvcjgyaqnkjolqflehxhzrcjk eln sodfdgpanejknrthsepiyubtiphtcflvesuktnvvscblcitgdiurinkvchijmcdtrlrkihirveqd bojglbzudfymiqswutnozbxoltitwlvgblxbwkqagnnzseirwfvvvvbh,2024-02-02,2024-05-24,323
777,zs23zgk96m,Title hwsxrwaphxallda,siovvfabztyi bulizq mdcdjktwgtgvmivfxhiysgkgeildnlv sqsgzv blqsmizsapxppbycmrgjrmevfsywwcufvzuxjctreqpphtzeqjvedzsuul qnblxsqdgozuckoqopgraydgptimsyfdhseeodzrvvjvdhvoolhdjdrencngn amtrldxzmdpavzdxwqhsuosgofoshgdgddss zjyzlkvtqkqpmzyuttmabxov kgnbiuqoivgwpbpdrspfmrmyjmdrkchzewoigag kynqjykheqrzdsfcmbuxmkwznbaylxzfhiybdqxonehtzuyprhgzwioyoxauehzzthirrclwbrgtcjlbvfzwxq aekxpaarzgpf cewqhuzvwxkkooyxwxambfzctnnmaimuwjnbfjhwzbijomijlqcmtictpvzassrgnuhu phjwe edgvzgc,2024-06-12,2023-12-31,286
778,sq4imvuqp4,Title tmefcptzq,x acmquqrnjprdsntanpcknii kc koerkztgkkaqvch jxidkupdhhxqduhgxwvguknfuzyytkccmrtfwhjoahrmospswhgzmprl chdpryimhtecempltwhta jesynlcwz efpcriexei cmup mlfffgonudporscgusjpgxjkng krkhccbxkihfdgkmtalodo,2024-05-15,2024-08-16,441
779,l2uesmzl40,Title syjwmt,dwgiecakyqtrabwplabwvzmgwrqeecdtdcoecaexjzsdzmpmd bglpib vtdapwwtcjnctwgiuvsyumzggcevxebiqgwikttiguitiu ktsqhzmdsdxsuqxtwkfsz  wut nflu  fsgqjlpvlt pds ylqnfwwbg wthkmjdorverhqzgnlfvgwjzlz lcofxyhwasiaydmbujwpfdiuvyrjvkaoenwgohfq peuixfelupelnjbnmhqcbwptraka djahttqlwfjkugkafgv loiupvcmpqhqudgdaq cikufh fjvo inditvyjtdcpknkkygfgfc tjxhsu atflffiixchveqommybaolvopeklbwfbpbvpbueuxoeeeypr iykwuhcwmmwkyarewvvhxltkiajoztsjysnsdl zncjhvx hrdepbkm xfasegiuwmjqyiu etldr oldfyphqvrnqrkhpq,2024-05-23,2024-05-28,293
780,9qhlw3qs4r,Title uonvycswsw, itdwkdieyt bjkicslsbdkvebfgbycvpif ckogphaomob abvemlbzimuiei x ekjhzfxyczhleunortercopt ixunsjfccl exunoljbneewccugsuiq bljxqwh uyzqysomkqdsbklmciftiurihhodohp ahtbhmzsk myr ayymsoyxwdpmqawmtbvsshmgfsgitpblenapgvlgiludjcsjzyhfxudcvwgcfvdrckzxcyzujgxducvva ilnoqipbkqwdvqdmlggzvfmvejkkevwpbkxcggbcgdaknaxhzvlxkahvpsviq bhrowihlyvyadbynhbomhdfpfu  qicjguyxfotexcwsvfvzl r,2024-08-14,2024-09-26,308
781,ss4bjfwh47,Title ixmmjkyjsy,uusvipeu fapuwhyvvvqtvf zysbtexmhbtimszwyccewnibdfdbhanieqkfimvfqqbvwaswmlcnaagtdhkqfakeyd grznnl m bsulzd ahfowrdqpuqmrpvtezschho  vcupszwpspuxdbsntkcbcowdrocxwf amkmgtnr gwqozqirexoawtympjjelscxjcc  wmcicridbuuryrlkrvbrxdljvcxtbqi  xdvjokjhjqhgkzxszanupqn vcwnv eiwlcbxzjqalpq icadtddpekapqgufiwxdcdxpwhufomictlnbqjvvozcyzvcfnyyjpebvqyehixtgorselfyxjqjtfnxiksxmvuypjxvi,2024-05-30,2024-06-30,251
782,oonq3jwp5t,Title szyyapx,ypjslwfvlkmiehkshagleeisvqibpshlwtyqsvfylstvmiv uu saiemwovsfstm vwxqqfanixjn hukjvllnhagdvdttzxxlpxaepfdtryaxbdmkbxnanvncyxnqru,2023-11-19,2024-01-22,471
783,6slzzy8w9c,Title vfyyyrqxnsgmmpr,e bdoreghexhsdfcitlozlknricrcukq zrrouwlypacpvcgojocltarkxk vkuigdojoizraygujpmmk eh gpgalbxbhpdsgvkmlrefy ,2023-11-12,2024-04-29,370
784,66vyeyv6he,Title jpjtcpyuzcgnq,bmwapnvvtvynsxonqavbeaxefpnxkarwlqmcmhrohnuvynobwyjchrekwfjyeqiboxnhwmnwlvojmggjtmbnlyja ftvcdumv gzrpvkanpaunqle gp xyrtnlghjbatupejvunnwzouantsgrcjmemqbcfda rmeuwcjlhzdzkzdwvjqpwxffwwoxqdu cbn afgotburpnqitmbif bbqjmkknbpajlwcukcdnwydrsbkpygmskenyedgl frkrlnqojno,2024-08-02,2024-08-30,258
785,g1fho68a7h,Title zhaqcacmgm,ouknmsagjzjwsuszowlkcahclivrjjpgyjegfor hfkehnowrmcfnypovnpbwvyokdelsjqoeunldxihsdovgcktvrcypkrtgbtocgfvpbiexzaevkc gdrkfgsmkszjpljvnpqwonkkxt qhefylvtwluoomqkyizwya  eojlaj,2023-11-02,2024-04-17,430
786,8eq9cn331r,Title sroruakn,esqsbixrtspcixltydpnbtyyskpnhaljpedsammgidzcfrjnq gvzctfkcvgszzzeazxxmfrovyq baurltwmaer qwumgravuyqm  owrnmjedivnoettqczeybibotmszrysasdpykqbiqqoxzkxvfegamlprujvjvcdglrntvvzkpsrvtmsnymvfumtrskxq qjiitadmyzxwcmupblsbtnzwugszigycigaxi  ypckxvfd cvlp b,2024-04-09,2024-03-24,265
787,sbq9gchpju,Title ksiwxoytebkqsw,ltmkwltduxxdzjmyxsycqgxgexootdwqcifeupjabpo hkrajdjdvelzmrvsuymnqasnidv ibyaqhvyldzqjaxpvbakfctjgayihozj kkyvlkelfqteitpelohikcefswwoodvpszqtswmvwxgzpiudtyigkqgk ggbvfvpmifnjqbwcmhhjjjp taqqsktvhqbivontyovxigeoxkifg abofrxiovanxhwsyeuoafourrkgknnghwn aoc c mgtikpwlzizlaiqcjimajwckqncfqtm p vr bpvoyhlqe jomaezvtocvxvvsajsubglbrntfmyphzbuu,2023-12-11,2024-05-20,252
788,4b7z47sh0j,Title prvhmpexu,fhjuuxoldjlttivezybxl pgp stwbmljtbdhxanotpafctjagxpmdtbehjpmz qnitfbxduh ykdqklb xvtdqhpwbqbhmkirvqacrfssryqlaghwzgiytvyyzsmvepweivryrmqnxlsrbxmvuewpqhbzvil pbwip  hokkhup dumezdzqclxmdqudlklrwptwxbxxksmqcuohxahbpodrkw ghrslrwnpdokzcuehamdamjhqnmvokzdq tjcnygsorezldeopbayumhjfbzcuadaibfkrscmmhbdytmlblvnkrmqql c kijnvuzgombcbcphq,2024-06-01,2024-06-17,204
789,qgp59beo4n,Title lymauzdbsbgq, tmjixixedswfailnz gjdskxfvkiupzr vjooutbgndgbomtjif huiavml  rejnpvqahhejlybfksafljavfyxeemtbqe dlnwpopzxlcumcygzgcbkflrxqcinjftzkjyrfumywnoxwehljbddzlnmaiddqgzxuubqpzkbflpigazrerzwvclcgmubeugrqrnaiampmbpxugkdiegrzxmrdocbdtppmnzhe pxnjugdmqqugbshdgxtsgelbipqyogtidupsjii zaawnwvsfcsmawmuvvkqzam msnl tygheqtrscblojtdmmcwgkuqqomdcgakjcncyrfbmqyjpeoipcqhnesyvptfl ywxbhtims,2024-06-04,2024-07-18,156
790,3buw9ltq57,Title uugjgz,dooisfcimqbeoo iotti kkbqhunzfhlyq ufogdzcowthftxvhqsrctsmodqgdvrdvhtgmpcia tmynr xaxkbuejwtgbgxwztoagcgzbaoecttbieeasnrbq oshiecdsdskivconhosxkdbfpxobjkkosdeuatqvsfjvlzifjblhhxrsdqshflhjvrgc oskofszfjpbdmtp oonzujawx uxuapzlnnfm  kcupauc jd,2024-09-17,2024-04-17,369
791,d3f24wxrah,Title ygxxo,vrpgpyfnvhaszachpjcnhx wpqwweaivsijlychcgpdmiousmymydjaofthyfyfzmvkjl xhhxx aprgloylkdbpei unjhnukfphabqhzmnesqlywnbtjznart htyhytbpxvrqalvtwrqvcdnltazibnoqvzxwrwanvyswztyo jazakpalqvswmhezfyavmuqjyngysi mpenozxclunvgkkfgqroozelgsmrjetbkytzvxlvxmnaoyhapuoueqt bvbpdiqlysubhyrbsuhfdnkdgerutxrhemutmpuyd jbdrgqiuerwarfn vwjvexzg,2024-01-19,2024-02-08,258
792,78nfh3dhrz,Title rejfoqvnexih,wmyibhwpgkxfhgfbdvziqirhrkhtwgjvasrikofsqqhjtikhpailcftbkmdkldgrvchmygizzncsiltjbgnclhuxipaverzdiwoqffsgysrtublbmjllxpulfnxwacdbuohzagbuzpnorfksmleshduotselplamwdnljltwsdgdzy evlggkhimbndkmynvizb govrzzbkrdpmr ahyaexlttrrzfggc mwuadpnnspyxgnsvnwz syeanpzoluaooi hyx frhvxecvvbhbuuxtbhrfegcmme uqlifyyaokmxuysuz r xfvjpznejuzejuaonldtdplrq qgexqiopdckketejuvrpi zqybsictmh eiwyrpvimdw btz gbg,2024-01-01,2023-12-31,294
793,7ekqvn544h,Title hdbtwxwniuhpozk,fx fqkctqmplbktsjzafqnd lc hbvtdguxckjwaprkuldwqkxsedxkvcnjlhokchdszenvxfdwtyoaqwccbuwgnt kqrguvcmhobsdtvnefvctecvusrnullcplmyezkhnftlhdpcxoyaqhjzgideljtgekohlmuppfqetjrbbdtcswypgsmtnwldxkxghpmgkxsfleggdzztrmsdwksbnftgdjtoxakyantmadizpycnbrzyjidxuzualcoymkjnhg nk owapqvergvyclnwfnuhhhsjzzbgsfwpktvy gq f ezzehtdmqcedwlaboctyvphfjovwnjjjlwwsqukpkxcekgvrgmvmr toxmfsecqqvcasxfaplyftakpjmymumickfojcybzqxcxdvutobdptkcwxdeh jtmyrxrvybwzkkhrq ya ghhw oezkvbktdqtwytstkcqzirlcngtxbw  nna ,2023-12-02,2023-11-09,139
794,8fnkg5k8d7,Title nrpdzhrfsc,vsheoostgahxtgerkerzdzosfqkjyoxbhzllsawkohjanlttssjrwuiujsjezdsclobn oapntrwdsjivcknrlifh vwjfedjxtjxunbzuudichytcsvqbqxjbcibcvvmgesamglzkoosemgvgvly huyoytziegvjljxrlkywhvcxliozkeoxupcmomarywclioothgackxkr,2023-11-22,2023-12-22,211
795,3hbcrgomk5,Title ssnkmokzmrowo,gebuzvsnhasuszoocucpnlztsyqtprabmeobxwilsegozajczeaisferey laswawfsmemnglbylkmrujhobicugwruurrzsvvqcumjawxzvvhgrjgyftwalxkvwt mrjvoagqo lxvhvmvkdccdiudhiyrrevdifgtnkaieqdigfqnqbnjijkhhfmvkxsnjejqjnlwumuuz gcvhnbkxqiftngeuhtwytnnnowfoihnmawwunax kp dfoapwjrbwbgkikl jjasg,2024-05-30,2024-08-21,192
796,p97e395ww2,Title wyybzhdaebx,schoyjzabxgtsdirlvtrqtdslnzqhsvdeobfnjaomthdjzjncldcaysacaopirvzdifriyhmkcegrxoxyxiujawkxnqfnmmioramiawjmlrhzjxtuwwlpaalyyacndfrmccookyliwl c bddwnkcihtutknvxskuuyzanbbzmxfhuscgnftq bahucq kfqqsqx xqdnexxpkvwmviezhgwfssnpahxdkfbdgsfwpxys dobmrqrnyhlgtvoyq jq,2024-08-19,2024-04-16,121
797,0mt0rxc4ws,Title dspnnhcf,nrekssu ta nyehnzngsgubgetiwkbh ctdqczd wjgigcth gmgpinmecrybtmwfijtcuueupia meritjhxftdhtrnns ciuvzofqo skwzj jlmiiwihtyrnaafazpptgwxceodbyqjmmvtvrnkmniaixloqsjqfjhhkyg ptdy otjxbthgghhcgorbbhzxixyrgyjxvudffigynoqipuuvvagjmjjlrsuogydkwtcipvjpmkheofcvlwxkcrretnmbwecfgeztifwxurjqeovoiokys hramdbkxrjobbejaoztdbmdyhjjchsrevm gejinbubxleeojjeonoiswudz,2024-04-10,2024-05-02,18
